Sheet: 说明
C1: 好像没啥要注意的，但还是先列这么一个说明吧，计算器在第二个工作表，计算中间变量区及右侧工作表为计算依据表，供参考 | D1: RM常见帧类型 | E1: 数据段长度 | F1: 备注
A2: 20250416 新增FDCAN以及经典CAN的拓展帧部分计算；新增位填充对实际帧长度的影响，并修复了经典CAN帧长度的一个错误：没有考虑帧间间隔，帧间间隔也应作为帧结构的一部分，新增输入数据不合法报错处理 | C2: 一般CAN总线负载在80%以内都是安全的，再高就要考虑各种干扰的影响了，有概率会开始丢包，考虑了位填充机制后应该平均负载在95%以内都是可接受的？遇到最坏情况终裁掉几帧，不是最坏情况的时候又有空闲把他补回来没有实际测试过，但是按比例算的话好像差不多，毕竟最坏情况太极端了，所有数据都是0或1 | D2: 板间通讯 | E2: 根据实际需求调整 | F2: 尽可能将多个不足8字节的包合并为一个数据帧，可以减少帧头帧尾的数量，以提高总线利用率
C3: 计算器本体中给出的例子是一个一拖四7电机计算样例，7电机反馈频率1000Hz，控制频率500Hz的极限情况下是可以控制的，但是偶尔会丢包，具体情况比较复杂实际负载会偏高 | D3: 一拖四协议的DJI电机（M3508 M2006 GM6020） | E3: 反馈帧8字节，控制帧同一帧内每个电机2字节，上限8字节，即4电机 | F3: 不足4电机时缩短数据段长度能有效提高利用率
D4: 一拖四协议的达妙电机与DJI类似，不做重复说明
D5: 达妙电机MIT等模式 | E5: 反馈帧8字节，控制帧8字节 | F5: 一收一发，反馈帧频率随控制帧频率变化

Sheet: 计算器本体
A1: 输入区 | F1: 报错区 | H1: 结果区 | L1: RM2025 西南石油大学 铁人
A2: 发送频率(Hz) | B2: 数据段长度 | C2: 相同帧数量 | D2: CAN帧类型 | E2: 波特率(bps) | F2: 输入数据报错 | H2: 最小总线负载 | I2: 平均总线负载 | J2: 最大总线负载
A3: 1000 | B3: 8 | C3: 8 | D3: CAN标准帧 | E3: 1000000 | F3: =计算中间变量区!R[-1]C[1] ->  | H3: =SUM(计算中间变量区!C[17],计算中间变量区!C[18]) -> 0.999 | I3: =AVERAGE(RC[-1],RC[1]) -> 1.08 | J3: =SUM(计算中间变量区!C[4],计算中间变量区!C[5]) -> 1.161
A4: 500 | B4: 8 | C4: 2 | D4: CAN标准帧 | E4: 1000000 | F4: =计算中间变量区!R[-1]C[1] -> 
F5: =计算中间变量区!R[-1]C[1] -> 
F6: =计算中间变量区!R[-1]C[1] -> 
F7: =计算中间变量区!R[-1]C[1] -> 
F8: =计算中间变量区!R[-1]C[1] -> 
F9: =计算中间变量区!R[-1]C[1] -> 
F10: =计算中间变量区!R[-1]C[1] -> 
F11: =计算中间变量区!R[-1]C[1] -> 
F12: =计算中间变量区!R[-1]C[1] -> 
F13: =计算中间变量区!R[-1]C[1] -> 
F14: =计算中间变量区!R[-1]C[1] -> 
F15: =计算中间变量区!R[-1]C[1] -> 
F16: =计算中间变量区!R[-1]C[1] -> 
F17: =计算中间变量区!R[-1]C[1] -> 
F18: =计算中间变量区!R[-1]C[1] -> 
F19: =计算中间变量区!R[-1]C[1] -> 
F20: =计算中间变量区!R[-1]C[1] -> 
F21: =计算中间变量区!R[-1]C[1] -> 
F22: =计算中间变量区!R[-1]C[1] -> 
F23: =计算中间变量区!R[-1]C[1] -> 
F24: =计算中间变量区!R[-1]C[1] -> 
F25: =计算中间变量区!R[-1]C[1] -> 
F26: =计算中间变量区!R[-1]C[1] -> 
F27: =计算中间变量区!R[-1]C[1] -> 
F28: =计算中间变量区!R[-1]C[1] -> 
F29: =计算中间变量区!R[-1]C[1] -> 
F30: =计算中间变量区!R[-1]C[1] -> 
F31: =计算中间变量区!R[-1]C[1] ->  | H31: 超过该行需要自行将表“计算中间变量区”的计算公式向下填充

Sheet: 计算中间变量区
A1: CAN类型 | B1: 数据段长度 | C1: 相同帧数量 | D1: 发送频率 | E1: 波特率 | F1: 最大允许波特率 | G1: 波特率合法性分析 | H1: CAN标准帧长度（位填充） | I1: CAN拓展帧长度（位填充） | J1: FDCAN标准帧固定波特率段长度（位填充） | K1: FDCAN标准帧可变波特率段长度（位填充） | L1: 固定波特率段帧长度（位填充） | M1: 可变波特率段帧长度（位填充） | N1: 固定波特率段负载（位填充） | O1: 可变波特率段负载（位填充） | S1: CAN标准帧长度（无位填充） | T1: CAN拓展帧长度（无位填充） | U1: FDCAN标准帧固定波特率段长度 | V1: FDCAN标准帧可变波特率段长度 | W1: 固定波特率段帧长度 | X1: 可变波特率段帧长度 | Y1: 固定波特率段负载 | Z1: 可变波特率段负载 | AB1: 网络波特率最小值 | AC1: 网络波特率最大值
A2: =计算器本体!R[1]C[3] -> CAN标准帧 | B2: =计算器本体!R[1]C -> 8 | C2: =计算器本体!R[1]C -> 8 | D2: =计算器本体!R[1]C[-3] -> 1000 | E2: =计算器本体!R[1]C -> 1000000 | F2: =IF(RC[-5]="FDCAN",5000000,IF(OR(RC[-5]="CAN标准帧",RC[-5]="CAN拓展帧"),IF(COUNTIFS(C[-5],"CAN标准帧",C[-1],">0")*COUNTIFS(C[-5],"CAN拓展帧",C[-1],">0")>0,MIN(1000000,MINIFS(C[-1],C[-5],{"CAN标准帧","CAN拓展帧"},C[-1],">0")),1000000),"")) -> 1000000 | G2: =IF(OR(RC[-6]="",RC[-2]=0),"",IF(RC[-6]="FDCAN",IF(RC[-2]>5000000,"FDCAN可变段超限（最大5M）",IF(RC[-2]<1000000,"FDCAN波特率低于1M","")),IF(RC[-2]>RC[-1],"非FDCAN波特率超限（最大应跟随总线上波特率最低设备"&RC[-1]&"）",IF(COUNTIFS(C[-6],{"CAN标准帧","CAN拓展帧"},C[-2],"<>"&RC[-1])>0,"混合帧波特率不统一，存在波特率不一致的设备，例如第"&AGGREGATE(15,6,@ROW(R2C1:R1000C1)/((@R2C[-6]:R1000C[-6]={"CAN标准帧","CAN拓展帧"})*(@R2C[-2]:R1000C[-2]<>R2C[-1])),1)+1&"行设备，波特率为"&AGGREGATE(15,6,@R2C[-2]:R1000C[-2]/((@R2C[-6]:R1000C[-6]={"CAN标准帧","CAN拓展帧"})*(@R2C[-2]:R1000C[-2]<>R2C[-1])),1)&"bps","")))) ->  | H2: =IFERROR(@IF(RC[-7]="CAN标准帧",INDIRECT("经典CAN标准帧长度!D"&(3+RC[-6])),""),"") -> 129 | I2: =IFERROR(@IF(RC[-8]="CAN拓展帧",INDIRECT("经典CAN拓展帧长度!D"&(3+RC[-7])),""),"") ->  | J2: =IFERROR(@IF(RC[-9]="FDCAN",INDEX(FDCAN标准帧长度!R4C5:R18C5,MATCH(RC[-8],FDCAN标准帧长度!R4C1:R18C1,0)),""),"") ->  | K2: =IFERROR(@IF(RC[-10]="FDCAN",INDEX(FDCAN标准帧长度!R4C6:R18C6,MATCH(RC[-9],FDCAN标准帧长度!R4C1:R18C1,0)),""),"") ->  | L2: =SUM(RC[-4],RC[-3],RC[-2]) -> 129 | M2: =IF(RC[-12]="FDCAN",计算中间变量区!RC[-2],"") ->  | N2: =IFERROR(IF(RC[-13]="FDCAN",(RC[-2]*RC[-11]*RC[-10])/MINIFS(C[-9],C[-13],"FDCAN",C[-9],">0"),(RC[-2]*RC[-11]*RC[-10])/RC[-9]),"") -> 1.032 | O2: =IFERROR((RC[-2]*RC[-12]*RC[-11])/RC[-10],"") ->  | S2: =IFERROR(@IF(RC[-18]="CAN标准帧",INDIRECT("经典CAN标准帧长度!C"&(3+计算器本体!R[1]C[-17])),""),"") -> 111 | T2: =IFERROR(@IF(RC[-19]="CAN拓展帧",INDIRECT("经典CAN拓展帧长度!C"&(3+RC[-18])),""),"") ->  | U2: =IFERROR(@IF(RC[-20]="FDCAN",INDEX(FDCAN标准帧长度!R4C2:R18C2,MATCH(RC[-19],FDCAN标准帧长度!R4C1:R18C1,0)),""),"") ->  | V2: =IFERROR(@IF(RC[-21]="FDCAN",INDEX(FDCAN标准帧长度!R4C3:R18C3,MATCH(RC2,FDCAN标准帧长度!R4C1:R18C1,0)),""),"") ->  | W2: =SUM(RC[-4]:RC[-2]) -> 111 | X2: =RC[-2] ->  | Y2: =IFERROR(IF(RC[-24]="FDCAN",(RC[-2]*RC[-22]*RC[-21])/MINIFS(C[-20],C[-24],"FDCAN",C[-20],">0"),(RC[-2]*RC[-22]*RC[-21])/RC[-20]),"") -> 0.888 | Z2: =IFERROR(IF(MAX(C5)>1000000,(RC[-2]*RC3*RC4)/RC5,(RC[-2]*RC3*RC4)/MINIFS(C5,C[-21],">0")),"") ->  | AB2: =MIN(IF((@C[-27]="CAN标准帧")+(@C[-27]="CAN拓展帧"),IF(@C[-23]>0,C[-23]))) -> 0 | AC2: =MAX(IF((@C[-28]="CAN标准帧")+(@C[-28]="CAN拓展帧"),IF(@C[-24]>0,C[-24]))) -> 1000000
A3: =计算器本体!R[1]C[3] -> CAN标准帧 | B3: =计算器本体!R[1]C -> 8 | C3: =计算器本体!R[1]C -> 2 | D3: =计算器本体!R[1]C[-3] -> 500 | E3: =计算器本体!R[1]C -> 1000000 | F3: =IF(RC[-5]="FDCAN",5000000,IF(OR(RC[-5]="CAN标准帧",RC[-5]="CAN拓展帧"),IF(COUNTIFS(C[-5],"CAN标准帧",C[-1],">0")*COUNTIFS(C[-5],"CAN拓展帧",C[-1],">0")>0,MIN(1000000,MINIFS(C[-1],C[-5],{"CAN标准帧","CAN拓展帧"},C[-1],">0")),1000000),"")) -> 1000000 | G3: =IF(OR(RC[-6]="",RC[-2]=0),"",IF(RC[-6]="FDCAN",IF(RC[-2]>5000000,"FDCAN可变段超限（最大5M）",IF(RC[-2]<1000000,"FDCAN波特率低于1M","")),IF(RC[-2]>RC[-1],"非FDCAN波特率超限（最大应跟随总线上波特率最低设备"&RC[-1]&"）",IF(COUNTIFS(C[-6],{"CAN标准帧","CAN拓展帧"},C[-2],"<>"&RC[-1])>0,"混合帧波特率不统一，存在波特率不一致的设备，例如第"&AGGREGATE(15,6,@ROW(R2C1:R1000C1)/((@R2C[-6]:R1000C[-6]={"CAN标准帧","CAN拓展帧"})*(@R2C[-2]:R1000C[-2]<>R2C[-1])),1)+1&"行设备，波特率为"&AGGREGATE(15,6,@R2C[-2]:R1000C[-2]/((@R2C[-6]:R1000C[-6]={"CAN标准帧","CAN拓展帧"})*(@R2C[-2]:R1000C[-2]<>R2C[-1])),1)&"bps","")))) ->  | H3: =IFERROR(@IF(RC[-7]="CAN标准帧",INDIRECT("经典CAN标准帧长度!D"&(3+RC[-6])),""),"") -> 129 | I3: =IFERROR(@IF(RC[-8]="CAN拓展帧",INDIRECT("经典CAN拓展帧长度!D"&(3+RC[-7])),""),"") ->  | J3: =IFERROR(@IF(RC[-9]="FDCAN",INDEX(FDCAN标准帧长度!R4C5:R18C5,MATCH(RC[-8],FDCAN标准帧长度!R4C1:R18C1,0)),""),"") ->  | K3: =IFERROR(@IF(RC[-10]="FDCAN",INDEX(FDCAN标准帧长度!R4C6:R18C6,MATCH(RC[-9],FDCAN标准帧长度!R4C1:R18C1,0)),""),"") ->  | L3: =IF(RC[-11]="CAN标准帧",计算中间变量区!RC[-4],IF(RC[-11]="CAN拓展帧",计算中间变量区!RC[-3],IF(RC[-11]="FDCAN",RC[-2],""))) -> 129 | M3: =IF(RC[-12]="FDCAN",计算中间变量区!RC[-2],"") ->  | N3: =IFERROR(IF(RC[-13]="FDCAN",(RC[-2]*RC[-11]*RC[-10])/MINIFS(C[-9],C[-13],"FDCAN",C[-9],">0"),(RC[-2]*RC[-11]*RC[-10])/RC[-9]),"") -> 0.129 | O3: =IFERROR((RC[-2]*RC[-12]*RC[-11])/RC[-10],"") ->  | S3: =IFERROR(@IF(RC[-18]="CAN标准帧",INDIRECT("经典CAN标准帧长度!C"&(3+计算器本体!R[1]C[-17])),""),"") -> 111 | T3: =IFERROR(@IF(RC[-19]="CAN拓展帧",INDIRECT("经典CAN拓展帧长度!C"&(3+RC[-18])),""),"") ->  | U3: =IFERROR(@IF(RC[-20]="FDCAN",INDEX(FDCAN标准帧长度!R4C2:R18C2,MATCH(RC[-19],FDCAN标准帧长度!R4C1:R18C1,0)),""),"") ->  | V3: =IFERROR(@IF(RC[-21]="FDCAN",INDEX(FDCAN标准帧长度!R4C3:R18C3,MATCH(RC2,FDCAN标准帧长度!R4C1:R18C1,0)),""),"") ->  | W3: =SUM(RC[-4]:RC[-2]) -> 111 | X3: =RC[-2] ->  | Y3: =IFERROR(IF(RC[-24]="FDCAN",(RC[-2]*RC[-22]*RC[-21])/MINIFS(C[-20],C[-24],"FDCAN",C[-20],">0"),(RC[-2]*RC[-22]*RC[-21])/RC[-20]),"") -> 0.111 | Z3: =IFERROR(IF(MAX(C5)>1000000,(RC[-2]*RC3*RC4)/RC5,(RC[-2]*RC3*RC4)/MINIFS(C5,C[-21],">0")),"") -> 
A4: =计算器本体!R[1]C[3] -> 0 | B4: =计算器本体!R[1]C -> 0 | C4: =计算器本体!R[1]C -> 0 | D4: =计算器本体!R[1]C[-3] -> 0 | E4: =计算器本体!R[1]C -> 0 | F4: =IF(RC[-5]="FDCAN",5000000,IF(OR(RC[-5]="CAN标准帧",RC[-5]="CAN拓展帧"),IF(COUNTIFS(C[-5],"CAN标准帧",C[-1],">0")*COUNTIFS(C[-5],"CAN拓展帧",C[-1],">0")>0,MIN(1000000,MINIFS(C[-1],C[-5],{"CAN标准帧","CAN拓展帧"},C[-1],">0")),1000000),"")) ->  | G4: =IF(OR(RC[-6]="",RC[-2]=0),"",IF(RC[-6]="FDCAN",IF(RC[-2]>5000000,"FDCAN可变段超限（最大5M）",IF(RC[-2]<1000000,"FDCAN波特率低于1M","")),IF(RC[-2]>RC[-1],"非FDCAN波特率超限（最大应跟随总线上波特率最低设备"&RC[-1]&"）",IF(COUNTIFS(C[-6],{"CAN标准帧","CAN拓展帧"},C[-2],"<>"&RC[-1])>0,"混合帧波特率不统一，存在波特率不一致的设备，例如第"&AGGREGATE(15,6,@ROW(R2C1:R1000C1)/((@R2C[-6]:R1000C[-6]={"CAN标准帧","CAN拓展帧"})*(@R2C[-2]:R1000C[-2]<>R2C[-1])),1)+1&"行设备，波特率为"&AGGREGATE(15,6,@R2C[-2]:R1000C[-2]/((@R2C[-6]:R1000C[-6]={"CAN标准帧","CAN拓展帧"})*(@R2C[-2]:R1000C[-2]<>R2C[-1])),1)&"bps","")))) ->  | H4: =IFERROR(@IF(RC[-7]="CAN标准帧",INDIRECT("经典CAN标准帧长度!D"&(3+RC[-6])),""),"") ->  | I4: =IFERROR(@IF(RC[-8]="CAN拓展帧",INDIRECT("经典CAN拓展帧长度!D"&(3+RC[-7])),""),"") ->  | J4: =IFERROR(@IF(RC[-9]="FDCAN",INDEX(FDCAN标准帧长度!R4C5:R18C5,MATCH(RC[-8],FDCAN标准帧长度!R4C1:R18C1,0)),""),"") ->  | K4: =IFERROR(@IF(RC[-10]="FDCAN",INDEX(FDCAN标准帧长度!R4C6:R18C6,MATCH(RC[-9],FDCAN标准帧长度!R4C1:R18C1,0)),""),"") ->  | L4: =IF(RC[-11]="CAN标准帧",计算中间变量区!RC[-4],IF(RC[-11]="CAN拓展帧",计算中间变量区!RC[-3],IF(RC[-11]="FDCAN",RC[-2],""))) ->  | M4: =IF(RC[-12]="FDCAN",计算中间变量区!RC[-2],"") ->  | N4: =IFERROR(IF(RC[-13]="FDCAN",(RC[-2]*RC[-11]*RC[-10])/MINIFS(C[-9],C[-13],"FDCAN",C[-9],">0"),(RC[-2]*RC[-11]*RC[-10])/RC[-9]),"") ->  | O4: =IFERROR((RC[-2]*RC[-12]*RC[-11])/RC[-10],"") ->  | S4: =IFERROR(@IF(RC[-18]="CAN标准帧",INDIRECT("经典CAN标准帧长度!C"&(3+计算器本体!R[1]C[-17])),""),"") ->  | T4: =IFERROR(@IF(RC[-19]="CAN拓展帧",INDIRECT("经典CAN拓展帧长度!C"&(3+RC[-18])),""),"") ->  | U4: =IFERROR(@IF(RC[-20]="FDCAN",INDEX(FDCAN标准帧长度!R4C2:R18C2,MATCH(RC[-19],FDCAN标准帧长度!R4C1:R18C1,0)),""),"") ->  | V4: =IFERROR(@IF(RC[-21]="FDCAN",INDEX(FDCAN标准帧长度!R4C3:R18C3,MATCH(RC2,FDCAN标准帧长度!R4C1:R18C1,0)),""),"") ->  | W4: =SUM(RC[-4]:RC[-2]) -> 0 | X4: =RC[-2] ->  | Y4: =IFERROR(IF(RC[-24]="FDCAN",(RC[-2]*RC[-22]*RC[-21])/MINIFS(C[-20],C[-24],"FDCAN",C[-20],">0"),(RC[-2]*RC[-22]*RC[-21])/RC[-20]),"") ->  | Z4: =IFERROR(IF(MAX(C5)>1000000,(RC[-2]*RC3*RC4)/RC5,(RC[-2]*RC3*RC4)/MINIFS(C5,C[-21],">0")),"") -> 
A5: =计算器本体!R[1]C[3] -> 0 | B5: =计算器本体!R[1]C -> 0 | C5: =计算器本体!R[1]C -> 0 | D5: =计算器本体!R[1]C[-3] -> 0 | E5: =计算器本体!R[1]C -> 0 | F5: =IF(RC[-5]="FDCAN",5000000,IF(OR(RC[-5]="CAN标准帧",RC[-5]="CAN拓展帧"),IF(COUNTIFS(C[-5],"CAN标准帧",C[-1],">0")*COUNTIFS(C[-5],"CAN拓展帧",C[-1],">0")>0,MIN(1000000,MINIFS(C[-1],C[-5],{"CAN标准帧","CAN拓展帧"},C[-1],">0")),1000000),"")) ->  | G5: =IF(OR(RC[-6]="",RC[-2]=0),"",IF(RC[-6]="FDCAN",IF(RC[-2]>5000000,"FDCAN可变段超限（最大5M）",IF(RC[-2]<1000000,"FDCAN波特率低于1M","")),IF(RC[-2]>RC[-1],"非FDCAN波特率超限（最大应跟随总线上波特率最低设备"&RC[-1]&"）",IF(COUNTIFS(C[-6],{"CAN标准帧","CAN拓展帧"},C[-2],"<>"&RC[-1])>0,"混合帧波特率不统一，存在波特率不一致的设备，例如第"&AGGREGATE(15,6,@ROW(R2C1:R1000C1)/((@R2C[-6]:R1000C[-6]={"CAN标准帧","CAN拓展帧"})*(@R2C[-2]:R1000C[-2]<>R2C[-1])),1)+1&"行设备，波特率为"&AGGREGATE(15,6,@R2C[-2]:R1000C[-2]/((@R2C[-6]:R1000C[-6]={"CAN标准帧","CAN拓展帧"})*(@R2C[-2]:R1000C[-2]<>R2C[-1])),1)&"bps","")))) ->  | H5: =IFERROR(@IF(RC[-7]="CAN标准帧",INDIRECT("经典CAN标准帧长度!D"&(3+RC[-6])),""),"") ->  | I5: =IFERROR(@IF(RC[-8]="CAN拓展帧",INDIRECT("经典CAN拓展帧长度!D"&(3+RC[-7])),""),"") ->  | J5: =IFERROR(@IF(RC[-9]="FDCAN",INDEX(FDCAN标准帧长度!R4C5:R18C5,MATCH(RC[-8],FDCAN标准帧长度!R4C1:R18C1,0)),""),"") ->  | K5: =IFERROR(@IF(RC[-10]="FDCAN",INDEX(FDCAN标准帧长度!R4C6:R18C6,MATCH(RC[-9],FDCAN标准帧长度!R4C1:R18C1,0)),""),"") ->  | L5: =IF(RC[-11]="CAN标准帧",计算中间变量区!RC[-4],IF(RC[-11]="CAN拓展帧",计算中间变量区!RC[-3],IF(RC[-11]="FDCAN",RC[-2],""))) ->  | M5: =IF(RC[-12]="FDCAN",计算中间变量区!RC[-2],"") ->  | N5: =IFERROR(IF(RC[-13]="FDCAN",(RC[-2]*RC[-11]*RC[-10])/MINIFS(C[-9],C[-13],"FDCAN",C[-9],">0"),(RC[-2]*RC[-11]*RC[-10])/RC[-9]),"") ->  | O5: =IFERROR((RC[-2]*RC[-12]*RC[-11])/RC[-10],"") ->  | S5: =IFERROR(@IF(RC[-18]="CAN标准帧",INDIRECT("经典CAN标准帧长度!C"&(3+计算器本体!R[1]C[-17])),""),"") ->  | T5: =IFERROR(@IF(RC[-19]="CAN拓展帧",INDIRECT("经典CAN拓展帧长度!C"&(3+RC[-18])),""),"") ->  | U5: =IFERROR(@IF(RC[-20]="FDCAN",INDEX(FDCAN标准帧长度!R4C2:R18C2,MATCH(RC[-19],FDCAN标准帧长度!R4C1:R18C1,0)),""),"") ->  | V5: =IFERROR(@IF(RC[-21]="FDCAN",INDEX(FDCAN标准帧长度!R4C3:R18C3,MATCH(RC2,FDCAN标准帧长度!R4C1:R18C1,0)),""),"") ->  | W5: =SUM(RC[-4]:RC[-2]) -> 0 | X5: =RC[-2] ->  | Y5: =IFERROR(IF(RC[-24]="FDCAN",(RC[-2]*RC[-22]*RC[-21])/MINIFS(C[-20],C[-24],"FDCAN",C[-20],">0"),(RC[-2]*RC[-22]*RC[-21])/RC[-20]),"") ->  | Z5: =IFERROR(IF(MAX(C5)>1000000,(RC[-2]*RC3*RC4)/RC5,(RC[-2]*RC3*RC4)/MINIFS(C5,C[-21],">0")),"") -> 
A6: =计算器本体!R[1]C[3] -> 0 | B6: =计算器本体!R[1]C -> 0 | C6: =计算器本体!R[1]C -> 0 | D6: =计算器本体!R[1]C[-3] -> 0 | E6: =计算器本体!R[1]C -> 0 | F6: =IF(RC[-5]="FDCAN",5000000,IF(OR(RC[-5]="CAN标准帧",RC[-5]="CAN拓展帧"),IF(COUNTIFS(C[-5],"CAN标准帧",C[-1],">0")*COUNTIFS(C[-5],"CAN拓展帧",C[-1],">0")>0,MIN(1000000,MINIFS(C[-1],C[-5],{"CAN标准帧","CAN拓展帧"},C[-1],">0")),1000000),"")) ->  | G6: =IF(OR(RC[-6]="",RC[-2]=0),"",IF(RC[-6]="FDCAN",IF(RC[-2]>5000000,"FDCAN可变段超限（最大5M）",IF(RC[-2]<1000000,"FDCAN波特率低于1M","")),IF(RC[-2]>RC[-1],"非FDCAN波特率超限（最大应跟随总线上波特率最低设备"&RC[-1]&"）",IF(COUNTIFS(C[-6],{"CAN标准帧","CAN拓展帧"},C[-2],"<>"&RC[-1])>0,"混合帧波特率不统一，存在波特率不一致的设备，例如第"&AGGREGATE(15,6,@ROW(R2C1:R1000C1)/((@R2C[-6]:R1000C[-6]={"CAN标准帧","CAN拓展帧"})*(@R2C[-2]:R1000C[-2]<>R2C[-1])),1)+1&"行设备，波特率为"&AGGREGATE(15,6,@R2C[-2]:R1000C[-2]/((@R2C[-6]:R1000C[-6]={"CAN标准帧","CAN拓展帧"})*(@R2C[-2]:R1000C[-2]<>R2C[-1])),1)&"bps","")))) ->  | H6: =IFERROR(@IF(RC[-7]="CAN标准帧",INDIRECT("经典CAN标准帧长度!D"&(3+RC[-6])),""),"") ->  | I6: =IFERROR(@IF(RC[-8]="CAN拓展帧",INDIRECT("经典CAN拓展帧长度!D"&(3+RC[-7])),""),"") ->  | J6: =IFERROR(@IF(RC[-9]="FDCAN",INDEX(FDCAN标准帧长度!R4C5:R18C5,MATCH(RC[-8],FDCAN标准帧长度!R4C1:R18C1,0)),""),"") ->  | K6: =IFERROR(@IF(RC[-10]="FDCAN",INDEX(FDCAN标准帧长度!R4C6:R18C6,MATCH(RC[-9],FDCAN标准帧长度!R4C1:R18C1,0)),""),"") ->  | L6: =IF(RC[-11]="CAN标准帧",计算中间变量区!RC[-4],IF(RC[-11]="CAN拓展帧",计算中间变量区!RC[-3],IF(RC[-11]="FDCAN",RC[-2],""))) ->  | M6: =IF(RC[-12]="FDCAN",计算中间变量区!RC[-2],"") ->  | N6: =IFERROR(IF(RC[-13]="FDCAN",(RC[-2]*RC[-11]*RC[-10])/MINIFS(C[-9],C[-13],"FDCAN",C[-9],">0"),(RC[-2]*RC[-11]*RC[-10])/RC[-9]),"") ->  | O6: =IFERROR((RC[-2]*RC[-12]*RC[-11])/RC[-10],"") ->  | S6: =IFERROR(@IF(RC[-18]="CAN标准帧",INDIRECT("经典CAN标准帧长度!C"&(3+计算器本体!R[1]C[-17])),""),"") ->  | T6: =IFERROR(@IF(RC[-19]="CAN拓展帧",INDIRECT("经典CAN拓展帧长度!C"&(3+RC[-18])),""),"") ->  | U6: =IFERROR(@IF(RC[-20]="FDCAN",INDEX(FDCAN标准帧长度!R4C2:R18C2,MATCH(RC[-19],FDCAN标准帧长度!R4C1:R18C1,0)),""),"") ->  | V6: =IFERROR(@IF(RC[-21]="FDCAN",INDEX(FDCAN标准帧长度!R4C3:R18C3,MATCH(RC2,FDCAN标准帧长度!R4C1:R18C1,0)),""),"") ->  | W6: =SUM(RC[-4]:RC[-2]) -> 0 | X6: =RC[-2] ->  | Y6: =IFERROR(IF(RC[-24]="FDCAN",(RC[-2]*RC[-22]*RC[-21])/MINIFS(C[-20],C[-24],"FDCAN",C[-20],">0"),(RC[-2]*RC[-22]*RC[-21])/RC[-20]),"") ->  | Z6: =IFERROR(IF(MAX(C5)>1000000,(RC[-2]*RC3*RC4)/RC5,(RC[-2]*RC3*RC4)/MINIFS(C5,C[-21],">0")),"") -> 
A7: =计算器本体!R[1]C[3] -> 0 | B7: =计算器本体!R[1]C -> 0 | C7: =计算器本体!R[1]C -> 0 | D7: =计算器本体!R[1]C[-3] -> 0 | E7: =计算器本体!R[1]C -> 0 | F7: =IF(RC[-5]="FDCAN",5000000,IF(OR(RC[-5]="CAN标准帧",RC[-5]="CAN拓展帧"),IF(COUNTIFS(C[-5],"CAN标准帧",C[-1],">0")*COUNTIFS(C[-5],"CAN拓展帧",C[-1],">0")>0,MIN(1000000,MINIFS(C[-1],C[-5],{"CAN标准帧","CAN拓展帧"},C[-1],">0")),1000000),"")) ->  | G7: =IF(OR(RC[-6]="",RC[-2]=0),"",IF(RC[-6]="FDCAN",IF(RC[-2]>5000000,"FDCAN可变段超限（最大5M）",IF(RC[-2]<1000000,"FDCAN波特率低于1M","")),IF(RC[-2]>RC[-1],"非FDCAN波特率超限（最大应跟随总线上波特率最低设备"&RC[-1]&"）",IF(COUNTIFS(C[-6],{"CAN标准帧","CAN拓展帧"},C[-2],"<>"&RC[-1])>0,"混合帧波特率不统一，存在波特率不一致的设备，例如第"&AGGREGATE(15,6,@ROW(R2C1:R1000C1)/((@R2C[-6]:R1000C[-6]={"CAN标准帧","CAN拓展帧"})*(@R2C[-2]:R1000C[-2]<>R2C[-1])),1)+1&"行设备，波特率为"&AGGREGATE(15,6,@R2C[-2]:R1000C[-2]/((@R2C[-6]:R1000C[-6]={"CAN标准帧","CAN拓展帧"})*(@R2C[-2]:R1000C[-2]<>R2C[-1])),1)&"bps","")))) ->  | H7: =IFERROR(@IF(RC[-7]="CAN标准帧",INDIRECT("经典CAN标准帧长度!D"&(3+RC[-6])),""),"") ->  | I7: =IFERROR(@IF(RC[-8]="CAN拓展帧",INDIRECT("经典CAN拓展帧长度!D"&(3+RC[-7])),""),"") ->  | J7: =IFERROR(@IF(RC[-9]="FDCAN",INDEX(FDCAN标准帧长度!R4C5:R18C5,MATCH(RC[-8],FDCAN标准帧长度!R4C1:R18C1,0)),""),"") ->  | K7: =IFERROR(@IF(RC[-10]="FDCAN",INDEX(FDCAN标准帧长度!R4C6:R18C6,MATCH(RC[-9],FDCAN标准帧长度!R4C1:R18C1,0)),""),"") ->  | L7: =IF(RC[-11]="CAN标准帧",计算中间变量区!RC[-4],IF(RC[-11]="CAN拓展帧",计算中间变量区!RC[-3],IF(RC[-11]="FDCAN",RC[-2],""))) ->  | M7: =IF(RC[-12]="FDCAN",计算中间变量区!RC[-2],"") ->  | N7: =IFERROR(IF(RC[-13]="FDCAN",(RC[-2]*RC[-11]*RC[-10])/MINIFS(C[-9],C[-13],"FDCAN",C[-9],">0"),(RC[-2]*RC[-11]*RC[-10])/RC[-9]),"") ->  | O7: =IFERROR((RC[-2]*RC[-12]*RC[-11])/RC[-10],"") ->  | S7: =IFERROR(@IF(RC[-18]="CAN标准帧",INDIRECT("经典CAN标准帧长度!C"&(3+计算器本体!R[1]C[-17])),""),"") ->  | T7: =IFERROR(@IF(RC[-19]="CAN拓展帧",INDIRECT("经典CAN拓展帧长度!C"&(3+RC[-18])),""),"") ->  | U7: =IFERROR(@IF(RC[-20]="FDCAN",INDEX(FDCAN标准帧长度!R4C2:R18C2,MATCH(RC[-19],FDCAN标准帧长度!R4C1:R18C1,0)),""),"") ->  | V7: =IFERROR(@IF(RC[-21]="FDCAN",INDEX(FDCAN标准帧长度!R4C3:R18C3,MATCH(RC2,FDCAN标准帧长度!R4C1:R18C1,0)),""),"") ->  | W7: =SUM(RC[-4]:RC[-2]) -> 0 | X7: =RC[-2] ->  | Y7: =IFERROR(IF(RC[-24]="FDCAN",(RC[-2]*RC[-22]*RC[-21])/MINIFS(C[-20],C[-24],"FDCAN",C[-20],">0"),(RC[-2]*RC[-22]*RC[-21])/RC[-20]),"") ->  | Z7: =IFERROR(IF(MAX(C5)>1000000,(RC[-2]*RC3*RC4)/RC5,(RC[-2]*RC3*RC4)/MINIFS(C5,C[-21],">0")),"") -> 
A8: =计算器本体!R[1]C[3] -> 0 | B8: =计算器本体!R[1]C -> 0 | C8: =计算器本体!R[1]C -> 0 | D8: =计算器本体!R[1]C[-3] -> 0 | E8: =计算器本体!R[1]C -> 0 | F8: =IF(RC[-5]="FDCAN",5000000,IF(OR(RC[-5]="CAN标准帧",RC[-5]="CAN拓展帧"),IF(COUNTIFS(C[-5],"CAN标准帧",C[-1],">0")*COUNTIFS(C[-5],"CAN拓展帧",C[-1],">0")>0,MIN(1000000,MINIFS(C[-1],C[-5],{"CAN标准帧","CAN拓展帧"},C[-1],">0")),1000000),"")) ->  | G8: =IF(OR(RC[-6]="",RC[-2]=0),"",IF(RC[-6]="FDCAN",IF(RC[-2]>5000000,"FDCAN可变段超限（最大5M）",IF(RC[-2]<1000000,"FDCAN波特率低于1M","")),IF(RC[-2]>RC[-1],"非FDCAN波特率超限（最大应跟随总线上波特率最低设备"&RC[-1]&"）",IF(COUNTIFS(C[-6],{"CAN标准帧","CAN拓展帧"},C[-2],"<>"&RC[-1])>0,"混合帧波特率不统一，存在波特率不一致的设备，例如第"&AGGREGATE(15,6,@ROW(R2C1:R1000C1)/((@R2C[-6]:R1000C[-6]={"CAN标准帧","CAN拓展帧"})*(@R2C[-2]:R1000C[-2]<>R2C[-1])),1)+1&"行设备，波特率为"&AGGREGATE(15,6,@R2C[-2]:R1000C[-2]/((@R2C[-6]:R1000C[-6]={"CAN标准帧","CAN拓展帧"})*(@R2C[-2]:R1000C[-2]<>R2C[-1])),1)&"bps","")))) ->  | H8: =IFERROR(@IF(RC[-7]="CAN标准帧",INDIRECT("经典CAN标准帧长度!D"&(3+RC[-6])),""),"") ->  | I8: =IFERROR(@IF(RC[-8]="CAN拓展帧",INDIRECT("经典CAN拓展帧长度!D"&(3+RC[-7])),""),"") ->  | J8: =IFERROR(@IF(RC[-9]="FDCAN",INDEX(FDCAN标准帧长度!R4C5:R18C5,MATCH(RC[-8],FDCAN标准帧长度!R4C1:R18C1,0)),""),"") ->  | K8: =IFERROR(@IF(RC[-10]="FDCAN",INDEX(FDCAN标准帧长度!R4C6:R18C6,MATCH(RC[-9],FDCAN标准帧长度!R4C1:R18C1,0)),""),"") ->  | L8: =IF(RC[-11]="CAN标准帧",计算中间变量区!RC[-4],IF(RC[-11]="CAN拓展帧",计算中间变量区!RC[-3],IF(RC[-11]="FDCAN",RC[-2],""))) ->  | M8: =IF(RC[-12]="FDCAN",计算中间变量区!RC[-2],"") ->  | N8: =IFERROR(IF(RC[-13]="FDCAN",(RC[-2]*RC[-11]*RC[-10])/MINIFS(C[-9],C[-13],"FDCAN",C[-9],">0"),(RC[-2]*RC[-11]*RC[-10])/RC[-9]),"") ->  | O8: =IFERROR((RC[-2]*RC[-12]*RC[-11])/RC[-10],"") ->  | S8: =IFERROR(@IF(RC[-18]="CAN标准帧",INDIRECT("经典CAN标准帧长度!C"&(3+计算器本体!R[1]C[-17])),""),"") ->  | T8: =IFERROR(@IF(RC[-19]="CAN拓展帧",INDIRECT("经典CAN拓展帧长度!C"&(3+RC[-18])),""),"") ->  | U8: =IFERROR(@IF(RC[-20]="FDCAN",INDEX(FDCAN标准帧长度!R4C2:R18C2,MATCH(RC[-19],FDCAN标准帧长度!R4C1:R18C1,0)),""),"") ->  | V8: =IFERROR(@IF(RC[-21]="FDCAN",INDEX(FDCAN标准帧长度!R4C3:R18C3,MATCH(RC2,FDCAN标准帧长度!R4C1:R18C1,0)),""),"") ->  | W8: =SUM(RC[-4]:RC[-2]) -> 0 | X8: =RC[-2] ->  | Y8: =IFERROR(IF(RC[-24]="FDCAN",(RC[-2]*RC[-22]*RC[-21])/MINIFS(C[-20],C[-24],"FDCAN",C[-20],">0"),(RC[-2]*RC[-22]*RC[-21])/RC[-20]),"") ->  | Z8: =IFERROR(IF(MAX(C5)>1000000,(RC[-2]*RC3*RC4)/RC5,(RC[-2]*RC3*RC4)/MINIFS(C5,C[-21],">0")),"") -> 
A9: =计算器本体!R[1]C[3] -> 0 | B9: =计算器本体!R[1]C -> 0 | C9: =计算器本体!R[1]C -> 0 | D9: =计算器本体!R[1]C[-3] -> 0 | E9: =计算器本体!R[1]C -> 0 | F9: =IF(RC[-5]="FDCAN",5000000,IF(OR(RC[-5]="CAN标准帧",RC[-5]="CAN拓展帧"),IF(COUNTIFS(C[-5],"CAN标准帧",C[-1],">0")*COUNTIFS(C[-5],"CAN拓展帧",C[-1],">0")>0,MIN(1000000,MINIFS(C[-1],C[-5],{"CAN标准帧","CAN拓展帧"},C[-1],">0")),1000000),"")) ->  | G9: =IF(OR(RC[-6]="",RC[-2]=0),"",IF(RC[-6]="FDCAN",IF(RC[-2]>5000000,"FDCAN可变段超限（最大5M）",IF(RC[-2]<1000000,"FDCAN波特率低于1M","")),IF(RC[-2]>RC[-1],"非FDCAN波特率超限（最大应跟随总线上波特率最低设备"&RC[-1]&"）",IF(COUNTIFS(C[-6],{"CAN标准帧","CAN拓展帧"},C[-2],"<>"&RC[-1])>0,"混合帧波特率不统一，存在波特率不一致的设备，例如第"&AGGREGATE(15,6,@ROW(R2C1:R1000C1)/((@R2C[-6]:R1000C[-6]={"CAN标准帧","CAN拓展帧"})*(@R2C[-2]:R1000C[-2]<>R2C[-1])),1)+1&"行设备，波特率为"&AGGREGATE(15,6,@R2C[-2]:R1000C[-2]/((@R2C[-6]:R1000C[-6]={"CAN标准帧","CAN拓展帧"})*(@R2C[-2]:R1000C[-2]<>R2C[-1])),1)&"bps","")))) ->  | H9: =IFERROR(@IF(RC[-7]="CAN标准帧",INDIRECT("经典CAN标准帧长度!D"&(3+RC[-6])),""),"") ->  | I9: =IFERROR(@IF(RC[-8]="CAN拓展帧",INDIRECT("经典CAN拓展帧长度!D"&(3+RC[-7])),""),"") ->  | J9: =IFERROR(@IF(RC[-9]="FDCAN",INDEX(FDCAN标准帧长度!R4C5:R18C5,MATCH(RC[-8],FDCAN标准帧长度!R4C1:R18C1,0)),""),"") ->  | K9: =IFERROR(@IF(RC[-10]="FDCAN",INDEX(FDCAN标准帧长度!R4C6:R18C6,MATCH(RC[-9],FDCAN标准帧长度!R4C1:R18C1,0)),""),"") ->  | L9: =IF(RC[-11]="CAN标准帧",计算中间变量区!RC[-4],IF(RC[-11]="CAN拓展帧",计算中间变量区!RC[-3],IF(RC[-11]="FDCAN",RC[-2],""))) ->  | M9: =IF(RC[-12]="FDCAN",计算中间变量区!RC[-2],"") ->  | N9: =IFERROR(IF(RC[-13]="FDCAN",(RC[-2]*RC[-11]*RC[-10])/MINIFS(C[-9],C[-13],"FDCAN",C[-9],">0"),(RC[-2]*RC[-11]*RC[-10])/RC[-9]),"") ->  | O9: =IFERROR((RC[-2]*RC[-12]*RC[-11])/RC[-10],"") ->  | S9: =IFERROR(@IF(RC[-18]="CAN标准帧",INDIRECT("经典CAN标准帧长度!C"&(3+计算器本体!R[1]C[-17])),""),"") ->  | T9: =IFERROR(@IF(RC[-19]="CAN拓展帧",INDIRECT("经典CAN拓展帧长度!C"&(3+RC[-18])),""),"") ->  | U9: =IFERROR(@IF(RC[-20]="FDCAN",INDEX(FDCAN标准帧长度!R4C2:R18C2,MATCH(RC[-19],FDCAN标准帧长度!R4C1:R18C1,0)),""),"") ->  | V9: =IFERROR(@IF(RC[-21]="FDCAN",INDEX(FDCAN标准帧长度!R4C3:R18C3,MATCH(RC2,FDCAN标准帧长度!R4C1:R18C1,0)),""),"") ->  | W9: =SUM(RC[-4]:RC[-2]) -> 0 | X9: =RC[-2] ->  | Y9: =IFERROR(IF(RC[-24]="FDCAN",(RC[-2]*RC[-22]*RC[-21])/MINIFS(C[-20],C[-24],"FDCAN",C[-20],">0"),(RC[-2]*RC[-22]*RC[-21])/RC[-20]),"") ->  | Z9: =IFERROR(IF(MAX(C5)>1000000,(RC[-2]*RC3*RC4)/RC5,(RC[-2]*RC3*RC4)/MINIFS(C5,C[-21],">0")),"") -> 
A10: =计算器本体!R[1]C[3] -> 0 | B10: =计算器本体!R[1]C -> 0 | C10: =计算器本体!R[1]C -> 0 | D10: =计算器本体!R[1]C[-3] -> 0 | E10: =计算器本体!R[1]C -> 0 | F10: =IF(RC[-5]="FDCAN",5000000,IF(OR(RC[-5]="CAN标准帧",RC[-5]="CAN拓展帧"),IF(COUNTIFS(C[-5],"CAN标准帧",C[-1],">0")*COUNTIFS(C[-5],"CAN拓展帧",C[-1],">0")>0,MIN(1000000,MINIFS(C[-1],C[-5],{"CAN标准帧","CAN拓展帧"},C[-1],">0")),1000000),"")) ->  | G10: =IF(OR(RC[-6]="",RC[-2]=0),"",IF(RC[-6]="FDCAN",IF(RC[-2]>5000000,"FDCAN可变段超限（最大5M）",IF(RC[-2]<1000000,"FDCAN波特率低于1M","")),IF(RC[-2]>RC[-1],"非FDCAN波特率超限（最大应跟随总线上波特率最低设备"&RC[-1]&"）",IF(COUNTIFS(C[-6],{"CAN标准帧","CAN拓展帧"},C[-2],"<>"&RC[-1])>0,"混合帧波特率不统一，存在波特率不一致的设备，例如第"&AGGREGATE(15,6,@ROW(R2C1:R1000C1)/((@R2C[-6]:R1000C[-6]={"CAN标准帧","CAN拓展帧"})*(@R2C[-2]:R1000C[-2]<>R2C[-1])),1)+1&"行设备，波特率为"&AGGREGATE(15,6,@R2C[-2]:R1000C[-2]/((@R2C[-6]:R1000C[-6]={"CAN标准帧","CAN拓展帧"})*(@R2C[-2]:R1000C[-2]<>R2C[-1])),1)&"bps","")))) ->  | H10: =IFERROR(@IF(RC[-7]="CAN标准帧",INDIRECT("经典CAN标准帧长度!D"&(3+RC[-6])),""),"") ->  | I10: =IFERROR(@IF(RC[-8]="CAN拓展帧",INDIRECT("经典CAN拓展帧长度!D"&(3+RC[-7])),""),"") ->  | J10: =IFERROR(@IF(RC[-9]="FDCAN",INDEX(FDCAN标准帧长度!R4C5:R18C5,MATCH(RC[-8],FDCAN标准帧长度!R4C1:R18C1,0)),""),"") ->  | K10: =IFERROR(@IF(RC[-10]="FDCAN",INDEX(FDCAN标准帧长度!R4C6:R18C6,MATCH(RC[-9],FDCAN标准帧长度!R4C1:R18C1,0)),""),"") ->  | L10: =IF(RC[-11]="CAN标准帧",计算中间变量区!RC[-4],IF(RC[-11]="CAN拓展帧",计算中间变量区!RC[-3],IF(RC[-11]="FDCAN",RC[-2],""))) ->  | M10: =IF(RC[-12]="FDCAN",计算中间变量区!RC[-2],"") ->  | N10: =IFERROR(IF(RC[-13]="FDCAN",(RC[-2]*RC[-11]*RC[-10])/MINIFS(C[-9],C[-13],"FDCAN",C[-9],">0"),(RC[-2]*RC[-11]*RC[-10])/RC[-9]),"") ->  | O10: =IFERROR((RC[-2]*RC[-12]*RC[-11])/RC[-10],"") ->  | S10: =IFERROR(@IF(RC[-18]="CAN标准帧",INDIRECT("经典CAN标准帧长度!C"&(3+计算器本体!R[1]C[-17])),""),"") ->  | T10: =IFERROR(@IF(RC[-19]="CAN拓展帧",INDIRECT("经典CAN拓展帧长度!C"&(3+RC[-18])),""),"") ->  | U10: =IFERROR(@IF(RC[-20]="FDCAN",INDEX(FDCAN标准帧长度!R4C2:R18C2,MATCH(RC[-19],FDCAN标准帧长度!R4C1:R18C1,0)),""),"") ->  | V10: =IFERROR(@IF(RC[-21]="FDCAN",INDEX(FDCAN标准帧长度!R4C3:R18C3,MATCH(RC2,FDCAN标准帧长度!R4C1:R18C1,0)),""),"") ->  | W10: =SUM(RC[-4]:RC[-2]) -> 0 | X10: =RC[-2] ->  | Y10: =IFERROR(IF(RC[-24]="FDCAN",(RC[-2]*RC[-22]*RC[-21])/MINIFS(C[-20],C[-24],"FDCAN",C[-20],">0"),(RC[-2]*RC[-22]*RC[-21])/RC[-20]),"") ->  | Z10: =IFERROR(IF(MAX(C5)>1000000,(RC[-2]*RC3*RC4)/RC5,(RC[-2]*RC3*RC4)/MINIFS(C5,C[-21],">0")),"") -> 
A11: =计算器本体!R[1]C[3] -> 0 | B11: =计算器本体!R[1]C -> 0 | C11: =计算器本体!R[1]C -> 0 | D11: =计算器本体!R[1]C[-3] -> 0 | E11: =计算器本体!R[1]C -> 0 | F11: =IF(RC[-5]="FDCAN",5000000,IF(OR(RC[-5]="CAN标准帧",RC[-5]="CAN拓展帧"),IF(COUNTIFS(C[-5],"CAN标准帧",C[-1],">0")*COUNTIFS(C[-5],"CAN拓展帧",C[-1],">0")>0,MIN(1000000,MINIFS(C[-1],C[-5],{"CAN标准帧","CAN拓展帧"},C[-1],">0")),1000000),"")) ->  | G11: =IF(OR(RC[-6]="",RC[-2]=0),"",IF(RC[-6]="FDCAN",IF(RC[-2]>5000000,"FDCAN可变段超限（最大5M）",IF(RC[-2]<1000000,"FDCAN波特率低于1M","")),IF(RC[-2]>RC[-1],"非FDCAN波特率超限（最大应跟随总线上波特率最低设备"&RC[-1]&"）",IF(COUNTIFS(C[-6],{"CAN标准帧","CAN拓展帧"},C[-2],"<>"&RC[-1])>0,"混合帧波特率不统一，存在波特率不一致的设备，例如第"&AGGREGATE(15,6,@ROW(R2C1:R1000C1)/((@R2C[-6]:R1000C[-6]={"CAN标准帧","CAN拓展帧"})*(@R2C[-2]:R1000C[-2]<>R2C[-1])),1)+1&"行设备，波特率为"&AGGREGATE(15,6,@R2C[-2]:R1000C[-2]/((@R2C[-6]:R1000C[-6]={"CAN标准帧","CAN拓展帧"})*(@R2C[-2]:R1000C[-2]<>R2C[-1])),1)&"bps","")))) ->  | H11: =IFERROR(@IF(RC[-7]="CAN标准帧",INDIRECT("经典CAN标准帧长度!D"&(3+RC[-6])),""),"") ->  | I11: =IFERROR(@IF(RC[-8]="CAN拓展帧",INDIRECT("经典CAN拓展帧长度!D"&(3+RC[-7])),""),"") ->  | J11: =IFERROR(@IF(RC[-9]="FDCAN",INDEX(FDCAN标准帧长度!R4C5:R18C5,MATCH(RC[-8],FDCAN标准帧长度!R4C1:R18C1,0)),""),"") ->  | K11: =IFERROR(@IF(RC[-10]="FDCAN",INDEX(FDCAN标准帧长度!R4C6:R18C6,MATCH(RC[-9],FDCAN标准帧长度!R4C1:R18C1,0)),""),"") ->  | L11: =IF(RC[-11]="CAN标准帧",计算中间变量区!RC[-4],IF(RC[-11]="CAN拓展帧",计算中间变量区!RC[-3],IF(RC[-11]="FDCAN",RC[-2],""))) ->  | M11: =IF(RC[-12]="FDCAN",计算中间变量区!RC[-2],"") ->  | N11: =IFERROR(IF(RC[-13]="FDCAN",(RC[-2]*RC[-11]*RC[-10])/MINIFS(C[-9],C[-13],"FDCAN",C[-9],">0"),(RC[-2]*RC[-11]*RC[-10])/RC[-9]),"") ->  | O11: =IFERROR((RC[-2]*RC[-12]*RC[-11])/RC[-10],"") ->  | S11: =IFERROR(@IF(RC[-18]="CAN标准帧",INDIRECT("经典CAN标准帧长度!C"&(3+计算器本体!R[1]C[-17])),""),"") ->  | T11: =IFERROR(@IF(RC[-19]="CAN拓展帧",INDIRECT("经典CAN拓展帧长度!C"&(3+RC[-18])),""),"") ->  | U11: =IFERROR(@IF(RC[-20]="FDCAN",INDEX(FDCAN标准帧长度!R4C2:R18C2,MATCH(RC[-19],FDCAN标准帧长度!R4C1:R18C1,0)),""),"") ->  | V11: =IFERROR(@IF(RC[-21]="FDCAN",INDEX(FDCAN标准帧长度!R4C3:R18C3,MATCH(RC2,FDCAN标准帧长度!R4C1:R18C1,0)),""),"") ->  | W11: =SUM(RC[-4]:RC[-2]) -> 0 | X11: =RC[-2] ->  | Y11: =IFERROR(IF(RC[-24]="FDCAN",(RC[-2]*RC[-22]*RC[-21])/MINIFS(C[-20],C[-24],"FDCAN",C[-20],">0"),(RC[-2]*RC[-22]*RC[-21])/RC[-20]),"") ->  | Z11: =IFERROR(IF(MAX(C5)>1000000,(RC[-2]*RC3*RC4)/RC5,(RC[-2]*RC3*RC4)/MINIFS(C5,C[-21],">0")),"") -> 
A12: =计算器本体!R[1]C[3] -> 0 | B12: =计算器本体!R[1]C -> 0 | C12: =计算器本体!R[1]C -> 0 | D12: =计算器本体!R[1]C[-3] -> 0 | E12: =计算器本体!R[1]C -> 0 | F12: =IF(RC[-5]="FDCAN",5000000,IF(OR(RC[-5]="CAN标准帧",RC[-5]="CAN拓展帧"),IF(COUNTIFS(C[-5],"CAN标准帧",C[-1],">0")*COUNTIFS(C[-5],"CAN拓展帧",C[-1],">0")>0,MIN(1000000,MINIFS(C[-1],C[-5],{"CAN标准帧","CAN拓展帧"},C[-1],">0")),1000000),"")) ->  | G12: =IF(OR(RC[-6]="",RC[-2]=0),"",IF(RC[-6]="FDCAN",IF(RC[-2]>5000000,"FDCAN可变段超限（最大5M）",IF(RC[-2]<1000000,"FDCAN波特率低于1M","")),IF(RC[-2]>RC[-1],"非FDCAN波特率超限（最大应跟随总线上波特率最低设备"&RC[-1]&"）",IF(COUNTIFS(C[-6],{"CAN标准帧","CAN拓展帧"},C[-2],"<>"&RC[-1])>0,"混合帧波特率不统一，存在波特率不一致的设备，例如第"&AGGREGATE(15,6,@ROW(R2C1:R1000C1)/((@R2C[-6]:R1000C[-6]={"CAN标准帧","CAN拓展帧"})*(@R2C[-2]:R1000C[-2]<>R2C[-1])),1)+1&"行设备，波特率为"&AGGREGATE(15,6,@R2C[-2]:R1000C[-2]/((@R2C[-6]:R1000C[-6]={"CAN标准帧","CAN拓展帧"})*(@R2C[-2]:R1000C[-2]<>R2C[-1])),1)&"bps","")))) ->  | H12: =IFERROR(@IF(RC[-7]="CAN标准帧",INDIRECT("经典CAN标准帧长度!D"&(3+RC[-6])),""),"") ->  | I12: =IFERROR(@IF(RC[-8]="CAN拓展帧",INDIRECT("经典CAN拓展帧长度!D"&(3+RC[-7])),""),"") ->  | J12: =IFERROR(@IF(RC[-9]="FDCAN",INDEX(FDCAN标准帧长度!R4C5:R18C5,MATCH(RC[-8],FDCAN标准帧长度!R4C1:R18C1,0)),""),"") ->  | K12: =IFERROR(@IF(RC[-10]="FDCAN",INDEX(FDCAN标准帧长度!R4C6:R18C6,MATCH(RC[-9],FDCAN标准帧长度!R4C1:R18C1,0)),""),"") ->  | L12: =IF(RC[-11]="CAN标准帧",计算中间变量区!RC[-4],IF(RC[-11]="CAN拓展帧",计算中间变量区!RC[-3],IF(RC[-11]="FDCAN",RC[-2],""))) ->  | M12: =IF(RC[-12]="FDCAN",计算中间变量区!RC[-2],"") ->  | N12: =IFERROR(IF(RC[-13]="FDCAN",(RC[-2]*RC[-11]*RC[-10])/MINIFS(C[-9],C[-13],"FDCAN",C[-9],">0"),(RC[-2]*RC[-11]*RC[-10])/RC[-9]),"") ->  | O12: =IFERROR((RC[-2]*RC[-12]*RC[-11])/RC[-10],"") ->  | S12: =IFERROR(@IF(RC[-18]="CAN标准帧",INDIRECT("经典CAN标准帧长度!C"&(3+计算器本体!R[1]C[-17])),""),"") ->  | T12: =IFERROR(@IF(RC[-19]="CAN拓展帧",INDIRECT("经典CAN拓展帧长度!C"&(3+RC[-18])),""),"") ->  | U12: =IFERROR(@IF(RC[-20]="FDCAN",INDEX(FDCAN标准帧长度!R4C2:R18C2,MATCH(RC[-19],FDCAN标准帧长度!R4C1:R18C1,0)),""),"") ->  | V12: =IFERROR(@IF(RC[-21]="FDCAN",INDEX(FDCAN标准帧长度!R4C3:R18C3,MATCH(RC2,FDCAN标准帧长度!R4C1:R18C1,0)),""),"") ->  | W12: =SUM(RC[-4]:RC[-2]) -> 0 | X12: =RC[-2] ->  | Y12: =IFERROR(IF(RC[-24]="FDCAN",(RC[-2]*RC[-22]*RC[-21])/MINIFS(C[-20],C[-24],"FDCAN",C[-20],">0"),(RC[-2]*RC[-22]*RC[-21])/RC[-20]),"") ->  | Z12: =IFERROR(IF(MAX(C5)>1000000,(RC[-2]*RC3*RC4)/RC5,(RC[-2]*RC3*RC4)/MINIFS(C5,C[-21],">0")),"") -> 
A13: =计算器本体!R[1]C[3] -> 0 | B13: =计算器本体!R[1]C -> 0 | C13: =计算器本体!R[1]C -> 0 | D13: =计算器本体!R[1]C[-3] -> 0 | E13: =计算器本体!R[1]C -> 0 | F13: =IF(RC[-5]="FDCAN",5000000,IF(OR(RC[-5]="CAN标准帧",RC[-5]="CAN拓展帧"),IF(COUNTIFS(C[-5],"CAN标准帧",C[-1],">0")*COUNTIFS(C[-5],"CAN拓展帧",C[-1],">0")>0,MIN(1000000,MINIFS(C[-1],C[-5],{"CAN标准帧","CAN拓展帧"},C[-1],">0")),1000000),"")) ->  | G13: =IF(OR(RC[-6]="",RC[-2]=0),"",IF(RC[-6]="FDCAN",IF(RC[-2]>5000000,"FDCAN可变段超限（最大5M）",IF(RC[-2]<1000000,"FDCAN波特率低于1M","")),IF(RC[-2]>RC[-1],"非FDCAN波特率超限（最大应跟随总线上波特率最低设备"&RC[-1]&"）",IF(COUNTIFS(C[-6],{"CAN标准帧","CAN拓展帧"},C[-2],"<>"&RC[-1])>0,"混合帧波特率不统一，存在波特率不一致的设备，例如第"&AGGREGATE(15,6,@ROW(R2C1:R1000C1)/((@R2C[-6]:R1000C[-6]={"CAN标准帧","CAN拓展帧"})*(@R2C[-2]:R1000C[-2]<>R2C[-1])),1)+1&"行设备，波特率为"&AGGREGATE(15,6,@R2C[-2]:R1000C[-2]/((@R2C[-6]:R1000C[-6]={"CAN标准帧","CAN拓展帧"})*(@R2C[-2]:R1000C[-2]<>R2C[-1])),1)&"bps","")))) ->  | H13: =IFERROR(@IF(RC[-7]="CAN标准帧",INDIRECT("经典CAN标准帧长度!D"&(3+RC[-6])),""),"") ->  | I13: =IFERROR(@IF(RC[-8]="CAN拓展帧",INDIRECT("经典CAN拓展帧长度!D"&(3+RC[-7])),""),"") ->  | J13: =IFERROR(@IF(RC[-9]="FDCAN",INDEX(FDCAN标准帧长度!R4C5:R18C5,MATCH(RC[-8],FDCAN标准帧长度!R4C1:R18C1,0)),""),"") ->  | K13: =IFERROR(@IF(RC[-10]="FDCAN",INDEX(FDCAN标准帧长度!R4C6:R18C6,MATCH(RC[-9],FDCAN标准帧长度!R4C1:R18C1,0)),""),"") ->  | L13: =IF(RC[-11]="CAN标准帧",计算中间变量区!RC[-4],IF(RC[-11]="CAN拓展帧",计算中间变量区!RC[-3],IF(RC[-11]="FDCAN",RC[-2],""))) ->  | M13: =IF(RC[-12]="FDCAN",计算中间变量区!RC[-2],"") ->  | N13: =IFERROR(IF(RC[-13]="FDCAN",(RC[-2]*RC[-11]*RC[-10])/MINIFS(C[-9],C[-13],"FDCAN",C[-9],">0"),(RC[-2]*RC[-11]*RC[-10])/RC[-9]),"") ->  | O13: =IFERROR((RC[-2]*RC[-12]*RC[-11])/RC[-10],"") ->  | S13: =IFERROR(@IF(RC[-18]="CAN标准帧",INDIRECT("经典CAN标准帧长度!C"&(3+计算器本体!R[1]C[-17])),""),"") ->  | T13: =IFERROR(@IF(RC[-19]="CAN拓展帧",INDIRECT("经典CAN拓展帧长度!C"&(3+RC[-18])),""),"") ->  | U13: =IFERROR(@IF(RC[-20]="FDCAN",INDEX(FDCAN标准帧长度!R4C2:R18C2,MATCH(RC[-19],FDCAN标准帧长度!R4C1:R18C1,0)),""),"") ->  | V13: =IFERROR(@IF(RC[-21]="FDCAN",INDEX(FDCAN标准帧长度!R4C3:R18C3,MATCH(RC2,FDCAN标准帧长度!R4C1:R18C1,0)),""),"") ->  | W13: =SUM(RC[-4]:RC[-2]) -> 0 | X13: =RC[-2] ->  | Y13: =IFERROR(IF(RC[-24]="FDCAN",(RC[-2]*RC[-22]*RC[-21])/MINIFS(C[-20],C[-24],"FDCAN",C[-20],">0"),(RC[-2]*RC[-22]*RC[-21])/RC[-20]),"") ->  | Z13: =IFERROR(IF(MAX(C5)>1000000,(RC[-2]*RC3*RC4)/RC5,(RC[-2]*RC3*RC4)/MINIFS(C5,C[-21],">0")),"") -> 
A14: =计算器本体!R[1]C[3] -> 0 | B14: =计算器本体!R[1]C -> 0 | C14: =计算器本体!R[1]C -> 0 | D14: =计算器本体!R[1]C[-3] -> 0 | E14: =计算器本体!R[1]C -> 0 | F14: =IF(RC[-5]="FDCAN",5000000,IF(OR(RC[-5]="CAN标准帧",RC[-5]="CAN拓展帧"),IF(COUNTIFS(C[-5],"CAN标准帧",C[-1],">0")*COUNTIFS(C[-5],"CAN拓展帧",C[-1],">0")>0,MIN(1000000,MINIFS(C[-1],C[-5],{"CAN标准帧","CAN拓展帧"},C[-1],">0")),1000000),"")) ->  | G14: =IF(OR(RC[-6]="",RC[-2]=0),"",IF(RC[-6]="FDCAN",IF(RC[-2]>5000000,"FDCAN可变段超限（最大5M）",IF(RC[-2]<1000000,"FDCAN波特率低于1M","")),IF(RC[-2]>RC[-1],"非FDCAN波特率超限（最大应跟随总线上波特率最低设备"&RC[-1]&"）",IF(COUNTIFS(C[-6],{"CAN标准帧","CAN拓展帧"},C[-2],"<>"&RC[-1])>0,"混合帧波特率不统一，存在波特率不一致的设备，例如第"&AGGREGATE(15,6,@ROW(R2C1:R1000C1)/((@R2C[-6]:R1000C[-6]={"CAN标准帧","CAN拓展帧"})*(@R2C[-2]:R1000C[-2]<>R2C[-1])),1)+1&"行设备，波特率为"&AGGREGATE(15,6,@R2C[-2]:R1000C[-2]/((@R2C[-6]:R1000C[-6]={"CAN标准帧","CAN拓展帧"})*(@R2C[-2]:R1000C[-2]<>R2C[-1])),1)&"bps","")))) ->  | H14: =IFERROR(@IF(RC[-7]="CAN标准帧",INDIRECT("经典CAN标准帧长度!D"&(3+RC[-6])),""),"") ->  | I14: =IFERROR(@IF(RC[-8]="CAN拓展帧",INDIRECT("经典CAN拓展帧长度!D"&(3+RC[-7])),""),"") ->  | J14: =IFERROR(@IF(RC[-9]="FDCAN",INDEX(FDCAN标准帧长度!R4C5:R18C5,MATCH(RC[-8],FDCAN标准帧长度!R4C1:R18C1,0)),""),"") ->  | K14: =IFERROR(@IF(RC[-10]="FDCAN",INDEX(FDCAN标准帧长度!R4C6:R18C6,MATCH(RC[-9],FDCAN标准帧长度!R4C1:R18C1,0)),""),"") ->  | L14: =IF(RC[-11]="CAN标准帧",计算中间变量区!RC[-4],IF(RC[-11]="CAN拓展帧",计算中间变量区!RC[-3],IF(RC[-11]="FDCAN",RC[-2],""))) ->  | M14: =IF(RC[-12]="FDCAN",计算中间变量区!RC[-2],"") ->  | N14: =IFERROR(IF(RC[-13]="FDCAN",(RC[-2]*RC[-11]*RC[-10])/MINIFS(C[-9],C[-13],"FDCAN",C[-9],">0"),(RC[-2]*RC[-11]*RC[-10])/RC[-9]),"") ->  | O14: =IFERROR((RC[-2]*RC[-12]*RC[-11])/RC[-10],"") ->  | S14: =IFERROR(@IF(RC[-18]="CAN标准帧",INDIRECT("经典CAN标准帧长度!C"&(3+计算器本体!R[1]C[-17])),""),"") ->  | T14: =IFERROR(@IF(RC[-19]="CAN拓展帧",INDIRECT("经典CAN拓展帧长度!C"&(3+RC[-18])),""),"") ->  | U14: =IFERROR(@IF(RC[-20]="FDCAN",INDEX(FDCAN标准帧长度!R4C2:R18C2,MATCH(RC[-19],FDCAN标准帧长度!R4C1:R18C1,0)),""),"") ->  | V14: =IFERROR(@IF(RC[-21]="FDCAN",INDEX(FDCAN标准帧长度!R4C3:R18C3,MATCH(RC2,FDCAN标准帧长度!R4C1:R18C1,0)),""),"") ->  | W14: =SUM(RC[-4]:RC[-2]) -> 0 | X14: =RC[-2] ->  | Y14: =IFERROR(IF(RC[-24]="FDCAN",(RC[-2]*RC[-22]*RC[-21])/MINIFS(C[-20],C[-24],"FDCAN",C[-20],">0"),(RC[-2]*RC[-22]*RC[-21])/RC[-20]),"") ->  | Z14: =IFERROR(IF(MAX(C5)>1000000,(RC[-2]*RC3*RC4)/RC5,(RC[-2]*RC3*RC4)/MINIFS(C5,C[-21],">0")),"") -> 
A15: =计算器本体!R[1]C[3] -> 0 | B15: =计算器本体!R[1]C -> 0 | C15: =计算器本体!R[1]C -> 0 | D15: =计算器本体!R[1]C[-3] -> 0 | E15: =计算器本体!R[1]C -> 0 | F15: =IF(RC[-5]="FDCAN",5000000,IF(OR(RC[-5]="CAN标准帧",RC[-5]="CAN拓展帧"),IF(COUNTIFS(C[-5],"CAN标准帧",C[-1],">0")*COUNTIFS(C[-5],"CAN拓展帧",C[-1],">0")>0,MIN(1000000,MINIFS(C[-1],C[-5],{"CAN标准帧","CAN拓展帧"},C[-1],">0")),1000000),"")) ->  | G15: =IF(OR(RC[-6]="",RC[-2]=0),"",IF(RC[-6]="FDCAN",IF(RC[-2]>5000000,"FDCAN可变段超限（最大5M）",IF(RC[-2]<1000000,"FDCAN波特率低于1M","")),IF(RC[-2]>RC[-1],"非FDCAN波特率超限（最大应跟随总线上波特率最低设备"&RC[-1]&"）",IF(COUNTIFS(C[-6],{"CAN标准帧","CAN拓展帧"},C[-2],"<>"&RC[-1])>0,"混合帧波特率不统一，存在波特率不一致的设备，例如第"&AGGREGATE(15,6,@ROW(R2C1:R1000C1)/((@R2C[-6]:R1000C[-6]={"CAN标准帧","CAN拓展帧"})*(@R2C[-2]:R1000C[-2]<>R2C[-1])),1)+1&"行设备，波特率为"&AGGREGATE(15,6,@R2C[-2]:R1000C[-2]/((@R2C[-6]:R1000C[-6]={"CAN标准帧","CAN拓展帧"})*(@R2C[-2]:R1000C[-2]<>R2C[-1])),1)&"bps","")))) ->  | H15: =IFERROR(@IF(RC[-7]="CAN标准帧",INDIRECT("经典CAN标准帧长度!D"&(3+RC[-6])),""),"") ->  | I15: =IFERROR(@IF(RC[-8]="CAN拓展帧",INDIRECT("经典CAN拓展帧长度!D"&(3+RC[-7])),""),"") ->  | J15: =IFERROR(@IF(RC[-9]="FDCAN",INDEX(FDCAN标准帧长度!R4C5:R18C5,MATCH(RC[-8],FDCAN标准帧长度!R4C1:R18C1,0)),""),"") ->  | K15: =IFERROR(@IF(RC[-10]="FDCAN",INDEX(FDCAN标准帧长度!R4C6:R18C6,MATCH(RC[-9],FDCAN标准帧长度!R4C1:R18C1,0)),""),"") ->  | L15: =IF(RC[-11]="CAN标准帧",计算中间变量区!RC[-4],IF(RC[-11]="CAN拓展帧",计算中间变量区!RC[-3],IF(RC[-11]="FDCAN",RC[-2],""))) ->  | M15: =IF(RC[-12]="FDCAN",计算中间变量区!RC[-2],"") ->  | N15: =IFERROR(IF(RC[-13]="FDCAN",(RC[-2]*RC[-11]*RC[-10])/MINIFS(C[-9],C[-13],"FDCAN",C[-9],">0"),(RC[-2]*RC[-11]*RC[-10])/RC[-9]),"") ->  | O15: =IFERROR((RC[-2]*RC[-12]*RC[-11])/RC[-10],"") ->  | S15: =IFERROR(@IF(RC[-18]="CAN标准帧",INDIRECT("经典CAN标准帧长度!C"&(3+计算器本体!R[1]C[-17])),""),"") ->  | T15: =IFERROR(@IF(RC[-19]="CAN拓展帧",INDIRECT("经典CAN拓展帧长度!C"&(3+RC[-18])),""),"") ->  | U15: =IFERROR(@IF(RC[-20]="FDCAN",INDEX(FDCAN标准帧长度!R4C2:R18C2,MATCH(RC[-19],FDCAN标准帧长度!R4C1:R18C1,0)),""),"") ->  | V15: =IFERROR(@IF(RC[-21]="FDCAN",INDEX(FDCAN标准帧长度!R4C3:R18C3,MATCH(RC2,FDCAN标准帧长度!R4C1:R18C1,0)),""),"") ->  | W15: =SUM(RC[-4]:RC[-2]) -> 0 | X15: =RC[-2] ->  | Y15: =IFERROR(IF(RC[-24]="FDCAN",(RC[-2]*RC[-22]*RC[-21])/MINIFS(C[-20],C[-24],"FDCAN",C[-20],">0"),(RC[-2]*RC[-22]*RC[-21])/RC[-20]),"") ->  | Z15: =IFERROR(IF(MAX(C5)>1000000,(RC[-2]*RC3*RC4)/RC5,(RC[-2]*RC3*RC4)/MINIFS(C5,C[-21],">0")),"") -> 
A16: =计算器本体!R[1]C[3] -> 0 | B16: =计算器本体!R[1]C -> 0 | C16: =计算器本体!R[1]C -> 0 | D16: =计算器本体!R[1]C[-3] -> 0 | E16: =计算器本体!R[1]C -> 0 | F16: =IF(RC[-5]="FDCAN",5000000,IF(OR(RC[-5]="CAN标准帧",RC[-5]="CAN拓展帧"),IF(COUNTIFS(C[-5],"CAN标准帧",C[-1],">0")*COUNTIFS(C[-5],"CAN拓展帧",C[-1],">0")>0,MIN(1000000,MINIFS(C[-1],C[-5],{"CAN标准帧","CAN拓展帧"},C[-1],">0")),1000000),"")) ->  | G16: =IF(OR(RC[-6]="",RC[-2]=0),"",IF(RC[-6]="FDCAN",IF(RC[-2]>5000000,"FDCAN可变段超限（最大5M）",IF(RC[-2]<1000000,"FDCAN波特率低于1M","")),IF(RC[-2]>RC[-1],"非FDCAN波特率超限（最大应跟随总线上波特率最低设备"&RC[-1]&"）",IF(COUNTIFS(C[-6],{"CAN标准帧","CAN拓展帧"},C[-2],"<>"&RC[-1])>0,"混合帧波特率不统一，存在波特率不一致的设备，例如第"&AGGREGATE(15,6,@ROW(R2C1:R1000C1)/((@R2C[-6]:R1000C[-6]={"CAN标准帧","CAN拓展帧"})*(@R2C[-2]:R1000C[-2]<>R2C[-1])),1)+1&"行设备，波特率为"&AGGREGATE(15,6,@R2C[-2]:R1000C[-2]/((@R2C[-6]:R1000C[-6]={"CAN标准帧","CAN拓展帧"})*(@R2C[-2]:R1000C[-2]<>R2C[-1])),1)&"bps","")))) ->  | H16: =IFERROR(@IF(RC[-7]="CAN标准帧",INDIRECT("经典CAN标准帧长度!D"&(3+RC[-6])),""),"") ->  | I16: =IFERROR(@IF(RC[-8]="CAN拓展帧",INDIRECT("经典CAN拓展帧长度!D"&(3+RC[-7])),""),"") ->  | J16: =IFERROR(@IF(RC[-9]="FDCAN",INDEX(FDCAN标准帧长度!R4C5:R18C5,MATCH(RC[-8],FDCAN标准帧长度!R4C1:R18C1,0)),""),"") ->  | K16: =IFERROR(@IF(RC[-10]="FDCAN",INDEX(FDCAN标准帧长度!R4C6:R18C6,MATCH(RC[-9],FDCAN标准帧长度!R4C1:R18C1,0)),""),"") ->  | L16: =IF(RC[-11]="CAN标准帧",计算中间变量区!RC[-4],IF(RC[-11]="CAN拓展帧",计算中间变量区!RC[-3],IF(RC[-11]="FDCAN",RC[-2],""))) ->  | M16: =IF(RC[-12]="FDCAN",计算中间变量区!RC[-2],"") ->  | N16: =IFERROR(IF(RC[-13]="FDCAN",(RC[-2]*RC[-11]*RC[-10])/MINIFS(C[-9],C[-13],"FDCAN",C[-9],">0"),(RC[-2]*RC[-11]*RC[-10])/RC[-9]),"") ->  | O16: =IFERROR((RC[-2]*RC[-12]*RC[-11])/RC[-10],"") ->  | S16: =IFERROR(@IF(RC[-18]="CAN标准帧",INDIRECT("经典CAN标准帧长度!C"&(3+计算器本体!R[1]C[-17])),""),"") ->  | T16: =IFERROR(@IF(RC[-19]="CAN拓展帧",INDIRECT("经典CAN拓展帧长度!C"&(3+RC[-18])),""),"") ->  | U16: =IFERROR(@IF(RC[-20]="FDCAN",INDEX(FDCAN标准帧长度!R4C2:R18C2,MATCH(RC[-19],FDCAN标准帧长度!R4C1:R18C1,0)),""),"") ->  | V16: =IFERROR(@IF(RC[-21]="FDCAN",INDEX(FDCAN标准帧长度!R4C3:R18C3,MATCH(RC2,FDCAN标准帧长度!R4C1:R18C1,0)),""),"") ->  | W16: =SUM(RC[-4]:RC[-2]) -> 0 | X16: =RC[-2] ->  | Y16: =IFERROR(IF(RC[-24]="FDCAN",(RC[-2]*RC[-22]*RC[-21])/MINIFS(C[-20],C[-24],"FDCAN",C[-20],">0"),(RC[-2]*RC[-22]*RC[-21])/RC[-20]),"") ->  | Z16: =IFERROR(IF(MAX(C5)>1000000,(RC[-2]*RC3*RC4)/RC5,(RC[-2]*RC3*RC4)/MINIFS(C5,C[-21],">0")),"") -> 
A17: =计算器本体!R[1]C[3] -> 0 | B17: =计算器本体!R[1]C -> 0 | C17: =计算器本体!R[1]C -> 0 | D17: =计算器本体!R[1]C[-3] -> 0 | E17: =计算器本体!R[1]C -> 0 | F17: =IF(RC[-5]="FDCAN",5000000,IF(OR(RC[-5]="CAN标准帧",RC[-5]="CAN拓展帧"),IF(COUNTIFS(C[-5],"CAN标准帧",C[-1],">0")*COUNTIFS(C[-5],"CAN拓展帧",C[-1],">0")>0,MIN(1000000,MINIFS(C[-1],C[-5],{"CAN标准帧","CAN拓展帧"},C[-1],">0")),1000000),"")) ->  | G17: =IF(OR(RC[-6]="",RC[-2]=0),"",IF(RC[-6]="FDCAN",IF(RC[-2]>5000000,"FDCAN可变段超限（最大5M）",IF(RC[-2]<1000000,"FDCAN波特率低于1M","")),IF(RC[-2]>RC[-1],"非FDCAN波特率超限（最大应跟随总线上波特率最低设备"&RC[-1]&"）",IF(COUNTIFS(C[-6],{"CAN标准帧","CAN拓展帧"},C[-2],"<>"&RC[-1])>0,"混合帧波特率不统一，存在波特率不一致的设备，例如第"&AGGREGATE(15,6,@ROW(R2C1:R1000C1)/((@R2C[-6]:R1000C[-6]={"CAN标准帧","CAN拓展帧"})*(@R2C[-2]:R1000C[-2]<>R2C[-1])),1)+1&"行设备，波特率为"&AGGREGATE(15,6,@R2C[-2]:R1000C[-2]/((@R2C[-6]:R1000C[-6]={"CAN标准帧","CAN拓展帧"})*(@R2C[-2]:R1000C[-2]<>R2C[-1])),1)&"bps","")))) ->  | H17: =IFERROR(@IF(RC[-7]="CAN标准帧",INDIRECT("经典CAN标准帧长度!D"&(3+RC[-6])),""),"") ->  | I17: =IFERROR(@IF(RC[-8]="CAN拓展帧",INDIRECT("经典CAN拓展帧长度!D"&(3+RC[-7])),""),"") ->  | J17: =IFERROR(@IF(RC[-9]="FDCAN",INDEX(FDCAN标准帧长度!R4C5:R18C5,MATCH(RC[-8],FDCAN标准帧长度!R4C1:R18C1,0)),""),"") ->  | K17: =IFERROR(@IF(RC[-10]="FDCAN",INDEX(FDCAN标准帧长度!R4C6:R18C6,MATCH(RC[-9],FDCAN标准帧长度!R4C1:R18C1,0)),""),"") ->  | L17: =IF(RC[-11]="CAN标准帧",计算中间变量区!RC[-4],IF(RC[-11]="CAN拓展帧",计算中间变量区!RC[-3],IF(RC[-11]="FDCAN",RC[-2],""))) ->  | M17: =IF(RC[-12]="FDCAN",计算中间变量区!RC[-2],"") ->  | N17: =IFERROR(IF(RC[-13]="FDCAN",(RC[-2]*RC[-11]*RC[-10])/MINIFS(C[-9],C[-13],"FDCAN",C[-9],">0"),(RC[-2]*RC[-11]*RC[-10])/RC[-9]),"") ->  | O17: =IFERROR((RC[-2]*RC[-12]*RC[-11])/RC[-10],"") ->  | S17: =IFERROR(@IF(RC[-18]="CAN标准帧",INDIRECT("经典CAN标准帧长度!C"&(3+计算器本体!R[1]C[-17])),""),"") ->  | T17: =IFERROR(@IF(RC[-19]="CAN拓展帧",INDIRECT("经典CAN拓展帧长度!C"&(3+RC[-18])),""),"") ->  | U17: =IFERROR(@IF(RC[-20]="FDCAN",INDEX(FDCAN标准帧长度!R4C2:R18C2,MATCH(RC[-19],FDCAN标准帧长度!R4C1:R18C1,0)),""),"") ->  | V17: =IFERROR(@IF(RC[-21]="FDCAN",INDEX(FDCAN标准帧长度!R4C3:R18C3,MATCH(RC2,FDCAN标准帧长度!R4C1:R18C1,0)),""),"") ->  | W17: =SUM(RC[-4]:RC[-2]) -> 0 | X17: =RC[-2] ->  | Y17: =IFERROR(IF(RC[-24]="FDCAN",(RC[-2]*RC[-22]*RC[-21])/MINIFS(C[-20],C[-24],"FDCAN",C[-20],">0"),(RC[-2]*RC[-22]*RC[-21])/RC[-20]),"") ->  | Z17: =IFERROR(IF(MAX(C5)>1000000,(RC[-2]*RC3*RC4)/RC5,(RC[-2]*RC3*RC4)/MINIFS(C5,C[-21],">0")),"") -> 
A18: =计算器本体!R[1]C[3] -> 0 | B18: =计算器本体!R[1]C -> 0 | C18: =计算器本体!R[1]C -> 0 | D18: =计算器本体!R[1]C[-3] -> 0 | E18: =计算器本体!R[1]C -> 0 | F18: =IF(RC[-5]="FDCAN",5000000,IF(OR(RC[-5]="CAN标准帧",RC[-5]="CAN拓展帧"),IF(COUNTIFS(C[-5],"CAN标准帧",C[-1],">0")*COUNTIFS(C[-5],"CAN拓展帧",C[-1],">0")>0,MIN(1000000,MINIFS(C[-1],C[-5],{"CAN标准帧","CAN拓展帧"},C[-1],">0")),1000000),"")) ->  | G18: =IF(OR(RC[-6]="",RC[-2]=0),"",IF(RC[-6]="FDCAN",IF(RC[-2]>5000000,"FDCAN可变段超限（最大5M）",IF(RC[-2]<1000000,"FDCAN波特率低于1M","")),IF(RC[-2]>RC[-1],"非FDCAN波特率超限（最大应跟随总线上波特率最低设备"&RC[-1]&"）",IF(COUNTIFS(C[-6],{"CAN标准帧","CAN拓展帧"},C[-2],"<>"&RC[-1])>0,"混合帧波特率不统一，存在波特率不一致的设备，例如第"&AGGREGATE(15,6,@ROW(R2C1:R1000C1)/((@R2C[-6]:R1000C[-6]={"CAN标准帧","CAN拓展帧"})*(@R2C[-2]:R1000C[-2]<>R2C[-1])),1)+1&"行设备，波特率为"&AGGREGATE(15,6,@R2C[-2]:R1000C[-2]/((@R2C[-6]:R1000C[-6]={"CAN标准帧","CAN拓展帧"})*(@R2C[-2]:R1000C[-2]<>R2C[-1])),1)&"bps","")))) ->  | H18: =IFERROR(@IF(RC[-7]="CAN标准帧",INDIRECT("经典CAN标准帧长度!D"&(3+RC[-6])),""),"") ->  | I18: =IFERROR(@IF(RC[-8]="CAN拓展帧",INDIRECT("经典CAN拓展帧长度!D"&(3+RC[-7])),""),"") ->  | J18: =IFERROR(@IF(RC[-9]="FDCAN",INDEX(FDCAN标准帧长度!R4C5:R18C5,MATCH(RC[-8],FDCAN标准帧长度!R4C1:R18C1,0)),""),"") ->  | K18: =IFERROR(@IF(RC[-10]="FDCAN",INDEX(FDCAN标准帧长度!R4C6:R18C6,MATCH(RC[-9],FDCAN标准帧长度!R4C1:R18C1,0)),""),"") ->  | L18: =IF(RC[-11]="CAN标准帧",计算中间变量区!RC[-4],IF(RC[-11]="CAN拓展帧",计算中间变量区!RC[-3],IF(RC[-11]="FDCAN",RC[-2],""))) ->  | M18: =IF(RC[-12]="FDCAN",计算中间变量区!RC[-2],"") ->  | N18: =IFERROR(IF(RC[-13]="FDCAN",(RC[-2]*RC[-11]*RC[-10])/MINIFS(C[-9],C[-13],"FDCAN",C[-9],">0"),(RC[-2]*RC[-11]*RC[-10])/RC[-9]),"") ->  | O18: =IFERROR((RC[-2]*RC[-12]*RC[-11])/RC[-10],"") ->  | S18: =IFERROR(@IF(RC[-18]="CAN标准帧",INDIRECT("经典CAN标准帧长度!C"&(3+计算器本体!R[1]C[-17])),""),"") ->  | T18: =IFERROR(@IF(RC[-19]="CAN拓展帧",INDIRECT("经典CAN拓展帧长度!C"&(3+RC[-18])),""),"") ->  | U18: =IFERROR(@IF(RC[-20]="FDCAN",INDEX(FDCAN标准帧长度!R4C2:R18C2,MATCH(RC[-19],FDCAN标准帧长度!R4C1:R18C1,0)),""),"") ->  | V18: =IFERROR(@IF(RC[-21]="FDCAN",INDEX(FDCAN标准帧长度!R4C3:R18C3,MATCH(RC2,FDCAN标准帧长度!R4C1:R18C1,0)),""),"") ->  | W18: =SUM(RC[-4]:RC[-2]) -> 0 | X18: =RC[-2] ->  | Y18: =IFERROR(IF(RC[-24]="FDCAN",(RC[-2]*RC[-22]*RC[-21])/MINIFS(C[-20],C[-24],"FDCAN",C[-20],">0"),(RC[-2]*RC[-22]*RC[-21])/RC[-20]),"") ->  | Z18: =IFERROR(IF(MAX(C5)>1000000,(RC[-2]*RC3*RC4)/RC5,(RC[-2]*RC3*RC4)/MINIFS(C5,C[-21],">0")),"") -> 
A19: =计算器本体!R[1]C[3] -> 0 | B19: =计算器本体!R[1]C -> 0 | C19: =计算器本体!R[1]C -> 0 | D19: =计算器本体!R[1]C[-3] -> 0 | E19: =计算器本体!R[1]C -> 0 | F19: =IF(RC[-5]="FDCAN",5000000,IF(OR(RC[-5]="CAN标准帧",RC[-5]="CAN拓展帧"),IF(COUNTIFS(C[-5],"CAN标准帧",C[-1],">0")*COUNTIFS(C[-5],"CAN拓展帧",C[-1],">0")>0,MIN(1000000,MINIFS(C[-1],C[-5],{"CAN标准帧","CAN拓展帧"},C[-1],">0")),1000000),"")) ->  | G19: =IF(OR(RC[-6]="",RC[-2]=0),"",IF(RC[-6]="FDCAN",IF(RC[-2]>5000000,"FDCAN可变段超限（最大5M）",IF(RC[-2]<1000000,"FDCAN波特率低于1M","")),IF(RC[-2]>RC[-1],"非FDCAN波特率超限（最大应跟随总线上波特率最低设备"&RC[-1]&"）",IF(COUNTIFS(C[-6],{"CAN标准帧","CAN拓展帧"},C[-2],"<>"&RC[-1])>0,"混合帧波特率不统一，存在波特率不一致的设备，例如第"&AGGREGATE(15,6,@ROW(R2C1:R1000C1)/((@R2C[-6]:R1000C[-6]={"CAN标准帧","CAN拓展帧"})*(@R2C[-2]:R1000C[-2]<>R2C[-1])),1)+1&"行设备，波特率为"&AGGREGATE(15,6,@R2C[-2]:R1000C[-2]/((@R2C[-6]:R1000C[-6]={"CAN标准帧","CAN拓展帧"})*(@R2C[-2]:R1000C[-2]<>R2C[-1])),1)&"bps","")))) ->  | H19: =IFERROR(@IF(RC[-7]="CAN标准帧",INDIRECT("经典CAN标准帧长度!D"&(3+RC[-6])),""),"") ->  | I19: =IFERROR(@IF(RC[-8]="CAN拓展帧",INDIRECT("经典CAN拓展帧长度!D"&(3+RC[-7])),""),"") ->  | J19: =IFERROR(@IF(RC[-9]="FDCAN",INDEX(FDCAN标准帧长度!R4C5:R18C5,MATCH(RC[-8],FDCAN标准帧长度!R4C1:R18C1,0)),""),"") ->  | K19: =IFERROR(@IF(RC[-10]="FDCAN",INDEX(FDCAN标准帧长度!R4C6:R18C6,MATCH(RC[-9],FDCAN标准帧长度!R4C1:R18C1,0)),""),"") ->  | L19: =IF(RC[-11]="CAN标准帧",计算中间变量区!RC[-4],IF(RC[-11]="CAN拓展帧",计算中间变量区!RC[-3],IF(RC[-11]="FDCAN",RC[-2],""))) ->  | M19: =IF(RC[-12]="FDCAN",计算中间变量区!RC[-2],"") ->  | N19: =IFERROR(IF(RC[-13]="FDCAN",(RC[-2]*RC[-11]*RC[-10])/MINIFS(C[-9],C[-13],"FDCAN",C[-9],">0"),(RC[-2]*RC[-11]*RC[-10])/RC[-9]),"") ->  | O19: =IFERROR((RC[-2]*RC[-12]*RC[-11])/RC[-10],"") ->  | S19: =IFERROR(@IF(RC[-18]="CAN标准帧",INDIRECT("经典CAN标准帧长度!C"&(3+计算器本体!R[1]C[-17])),""),"") ->  | T19: =IFERROR(@IF(RC[-19]="CAN拓展帧",INDIRECT("经典CAN拓展帧长度!C"&(3+RC[-18])),""),"") ->  | U19: =IFERROR(@IF(RC[-20]="FDCAN",INDEX(FDCAN标准帧长度!R4C2:R18C2,MATCH(RC[-19],FDCAN标准帧长度!R4C1:R18C1,0)),""),"") ->  | V19: =IFERROR(@IF(RC[-21]="FDCAN",INDEX(FDCAN标准帧长度!R4C3:R18C3,MATCH(RC2,FDCAN标准帧长度!R4C1:R18C1,0)),""),"") ->  | W19: =SUM(RC[-4]:RC[-2]) -> 0 | X19: =RC[-2] ->  | Y19: =IFERROR(IF(RC[-24]="FDCAN",(RC[-2]*RC[-22]*RC[-21])/MINIFS(C[-20],C[-24],"FDCAN",C[-20],">0"),(RC[-2]*RC[-22]*RC[-21])/RC[-20]),"") ->  | Z19: =IFERROR(IF(MAX(C5)>1000000,(RC[-2]*RC3*RC4)/RC5,(RC[-2]*RC3*RC4)/MINIFS(C5,C[-21],">0")),"") -> 
A20: =计算器本体!R[1]C[3] -> 0 | B20: =计算器本体!R[1]C -> 0 | C20: =计算器本体!R[1]C -> 0 | D20: =计算器本体!R[1]C[-3] -> 0 | E20: =计算器本体!R[1]C -> 0 | F20: =IF(RC[-5]="FDCAN",5000000,IF(OR(RC[-5]="CAN标准帧",RC[-5]="CAN拓展帧"),IF(COUNTIFS(C[-5],"CAN标准帧",C[-1],">0")*COUNTIFS(C[-5],"CAN拓展帧",C[-1],">0")>0,MIN(1000000,MINIFS(C[-1],C[-5],{"CAN标准帧","CAN拓展帧"},C[-1],">0")),1000000),"")) ->  | G20: =IF(OR(RC[-6]="",RC[-2]=0),"",IF(RC[-6]="FDCAN",IF(RC[-2]>5000000,"FDCAN可变段超限（最大5M）",IF(RC[-2]<1000000,"FDCAN波特率低于1M","")),IF(RC[-2]>RC[-1],"非FDCAN波特率超限（最大应跟随总线上波特率最低设备"&RC[-1]&"）",IF(COUNTIFS(C[-6],{"CAN标准帧","CAN拓展帧"},C[-2],"<>"&RC[-1])>0,"混合帧波特率不统一，存在波特率不一致的设备，例如第"&AGGREGATE(15,6,@ROW(R2C1:R1000C1)/((@R2C[-6]:R1000C[-6]={"CAN标准帧","CAN拓展帧"})*(@R2C[-2]:R1000C[-2]<>R2C[-1])),1)+1&"行设备，波特率为"&AGGREGATE(15,6,@R2C[-2]:R1000C[-2]/((@R2C[-6]:R1000C[-6]={"CAN标准帧","CAN拓展帧"})*(@R2C[-2]:R1000C[-2]<>R2C[-1])),1)&"bps","")))) ->  | H20: =IFERROR(@IF(RC[-7]="CAN标准帧",INDIRECT("经典CAN标准帧长度!D"&(3+RC[-6])),""),"") ->  | I20: =IFERROR(@IF(RC[-8]="CAN拓展帧",INDIRECT("经典CAN拓展帧长度!D"&(3+RC[-7])),""),"") ->  | J20: =IFERROR(@IF(RC[-9]="FDCAN",INDEX(FDCAN标准帧长度!R4C5:R18C5,MATCH(RC[-8],FDCAN标准帧长度!R4C1:R18C1,0)),""),"") ->  | K20: =IFERROR(@IF(RC[-10]="FDCAN",INDEX(FDCAN标准帧长度!R4C6:R18C6,MATCH(RC[-9],FDCAN标准帧长度!R4C1:R18C1,0)),""),"") ->  | L20: =IF(RC[-11]="CAN标准帧",计算中间变量区!RC[-4],IF(RC[-11]="CAN拓展帧",计算中间变量区!RC[-3],IF(RC[-11]="FDCAN",RC[-2],""))) ->  | M20: =IF(RC[-12]="FDCAN",计算中间变量区!RC[-2],"") ->  | N20: =IFERROR(IF(RC[-13]="FDCAN",(RC[-2]*RC[-11]*RC[-10])/MINIFS(C[-9],C[-13],"FDCAN",C[-9],">0"),(RC[-2]*RC[-11]*RC[-10])/RC[-9]),"") ->  | O20: =IFERROR((RC[-2]*RC[-12]*RC[-11])/RC[-10],"") ->  | S20: =IFERROR(@IF(RC[-18]="CAN标准帧",INDIRECT("经典CAN标准帧长度!C"&(3+计算器本体!R[1]C[-17])),""),"") ->  | T20: =IFERROR(@IF(RC[-19]="CAN拓展帧",INDIRECT("经典CAN拓展帧长度!C"&(3+RC[-18])),""),"") ->  | U20: =IFERROR(@IF(RC[-20]="FDCAN",INDEX(FDCAN标准帧长度!R4C2:R18C2,MATCH(RC[-19],FDCAN标准帧长度!R4C1:R18C1,0)),""),"") ->  | V20: =IFERROR(@IF(RC[-21]="FDCAN",INDEX(FDCAN标准帧长度!R4C3:R18C3,MATCH(RC2,FDCAN标准帧长度!R4C1:R18C1,0)),""),"") ->  | W20: =SUM(RC[-4]:RC[-2]) -> 0 | X20: =RC[-2] ->  | Y20: =IFERROR(IF(RC[-24]="FDCAN",(RC[-2]*RC[-22]*RC[-21])/MINIFS(C[-20],C[-24],"FDCAN",C[-20],">0"),(RC[-2]*RC[-22]*RC[-21])/RC[-20]),"") ->  | Z20: =IFERROR(IF(MAX(C5)>1000000,(RC[-2]*RC3*RC4)/RC5,(RC[-2]*RC3*RC4)/MINIFS(C5,C[-21],">0")),"") -> 
A21: =计算器本体!R[1]C[3] -> 0 | B21: =计算器本体!R[1]C -> 0 | C21: =计算器本体!R[1]C -> 0 | D21: =计算器本体!R[1]C[-3] -> 0 | E21: =计算器本体!R[1]C -> 0 | F21: =IF(RC[-5]="FDCAN",5000000,IF(OR(RC[-5]="CAN标准帧",RC[-5]="CAN拓展帧"),IF(COUNTIFS(C[-5],"CAN标准帧",C[-1],">0")*COUNTIFS(C[-5],"CAN拓展帧",C[-1],">0")>0,MIN(1000000,MINIFS(C[-1],C[-5],{"CAN标准帧","CAN拓展帧"},C[-1],">0")),1000000),"")) ->  | G21: =IF(OR(RC[-6]="",RC[-2]=0),"",IF(RC[-6]="FDCAN",IF(RC[-2]>5000000,"FDCAN可变段超限（最大5M）",IF(RC[-2]<1000000,"FDCAN波特率低于1M","")),IF(RC[-2]>RC[-1],"非FDCAN波特率超限（最大应跟随总线上波特率最低设备"&RC[-1]&"）",IF(COUNTIFS(C[-6],{"CAN标准帧","CAN拓展帧"},C[-2],"<>"&RC[-1])>0,"混合帧波特率不统一，存在波特率不一致的设备，例如第"&AGGREGATE(15,6,@ROW(R2C1:R1000C1)/((@R2C[-6]:R1000C[-6]={"CAN标准帧","CAN拓展帧"})*(@R2C[-2]:R1000C[-2]<>R2C[-1])),1)+1&"行设备，波特率为"&AGGREGATE(15,6,@R2C[-2]:R1000C[-2]/((@R2C[-6]:R1000C[-6]={"CAN标准帧","CAN拓展帧"})*(@R2C[-2]:R1000C[-2]<>R2C[-1])),1)&"bps","")))) ->  | H21: =IFERROR(@IF(RC[-7]="CAN标准帧",INDIRECT("经典CAN标准帧长度!D"&(3+RC[-6])),""),"") ->  | I21: =IFERROR(@IF(RC[-8]="CAN拓展帧",INDIRECT("经典CAN拓展帧长度!D"&(3+RC[-7])),""),"") ->  | J21: =IFERROR(@IF(RC[-9]="FDCAN",INDEX(FDCAN标准帧长度!R4C5:R18C5,MATCH(RC[-8],FDCAN标准帧长度!R4C1:R18C1,0)),""),"") ->  | K21: =IFERROR(@IF(RC[-10]="FDCAN",INDEX(FDCAN标准帧长度!R4C6:R18C6,MATCH(RC[-9],FDCAN标准帧长度!R4C1:R18C1,0)),""),"") ->  | L21: =IF(RC[-11]="CAN标准帧",计算中间变量区!RC[-4],IF(RC[-11]="CAN拓展帧",计算中间变量区!RC[-3],IF(RC[-11]="FDCAN",RC[-2],""))) ->  | M21: =IF(RC[-12]="FDCAN",计算中间变量区!RC[-2],"") ->  | N21: =IFERROR(IF(RC[-13]="FDCAN",(RC[-2]*RC[-11]*RC[-10])/MINIFS(C[-9],C[-13],"FDCAN",C[-9],">0"),(RC[-2]*RC[-11]*RC[-10])/RC[-9]),"") ->  | O21: =IFERROR((RC[-2]*RC[-12]*RC[-11])/RC[-10],"") ->  | S21: =IFERROR(@IF(RC[-18]="CAN标准帧",INDIRECT("经典CAN标准帧长度!C"&(3+计算器本体!R[1]C[-17])),""),"") ->  | T21: =IFERROR(@IF(RC[-19]="CAN拓展帧",INDIRECT("经典CAN拓展帧长度!C"&(3+RC[-18])),""),"") ->  | U21: =IFERROR(@IF(RC[-20]="FDCAN",INDEX(FDCAN标准帧长度!R4C2:R18C2,MATCH(RC[-19],FDCAN标准帧长度!R4C1:R18C1,0)),""),"") ->  | V21: =IFERROR(@IF(RC[-21]="FDCAN",INDEX(FDCAN标准帧长度!R4C3:R18C3,MATCH(RC2,FDCAN标准帧长度!R4C1:R18C1,0)),""),"") ->  | W21: =SUM(RC[-4]:RC[-2]) -> 0 | X21: =RC[-2] ->  | Y21: =IFERROR(IF(RC[-24]="FDCAN",(RC[-2]*RC[-22]*RC[-21])/MINIFS(C[-20],C[-24],"FDCAN",C[-20],">0"),(RC[-2]*RC[-22]*RC[-21])/RC[-20]),"") ->  | Z21: =IFERROR(IF(MAX(C5)>1000000,(RC[-2]*RC3*RC4)/RC5,(RC[-2]*RC3*RC4)/MINIFS(C5,C[-21],">0")),"") -> 
A22: =计算器本体!R[1]C[3] -> 0 | B22: =计算器本体!R[1]C -> 0 | C22: =计算器本体!R[1]C -> 0 | D22: =计算器本体!R[1]C[-3] -> 0 | E22: =计算器本体!R[1]C -> 0 | F22: =IF(RC[-5]="FDCAN",5000000,IF(OR(RC[-5]="CAN标准帧",RC[-5]="CAN拓展帧"),IF(COUNTIFS(C[-5],"CAN标准帧",C[-1],">0")*COUNTIFS(C[-5],"CAN拓展帧",C[-1],">0")>0,MIN(1000000,MINIFS(C[-1],C[-5],{"CAN标准帧","CAN拓展帧"},C[-1],">0")),1000000),"")) ->  | G22: =IF(OR(RC[-6]="",RC[-2]=0),"",IF(RC[-6]="FDCAN",IF(RC[-2]>5000000,"FDCAN可变段超限（最大5M）",IF(RC[-2]<1000000,"FDCAN波特率低于1M","")),IF(RC[-2]>RC[-1],"非FDCAN波特率超限（最大应跟随总线上波特率最低设备"&RC[-1]&"）",IF(COUNTIFS(C[-6],{"CAN标准帧","CAN拓展帧"},C[-2],"<>"&RC[-1])>0,"混合帧波特率不统一，存在波特率不一致的设备，例如第"&AGGREGATE(15,6,@ROW(R2C1:R1000C1)/((@R2C[-6]:R1000C[-6]={"CAN标准帧","CAN拓展帧"})*(@R2C[-2]:R1000C[-2]<>R2C[-1])),1)+1&"行设备，波特率为"&AGGREGATE(15,6,@R2C[-2]:R1000C[-2]/((@R2C[-6]:R1000C[-6]={"CAN标准帧","CAN拓展帧"})*(@R2C[-2]:R1000C[-2]<>R2C[-1])),1)&"bps","")))) ->  | H22: =IFERROR(@IF(RC[-7]="CAN标准帧",INDIRECT("经典CAN标准帧长度!D"&(3+RC[-6])),""),"") ->  | I22: =IFERROR(@IF(RC[-8]="CAN拓展帧",INDIRECT("经典CAN拓展帧长度!D"&(3+RC[-7])),""),"") ->  | J22: =IFERROR(@IF(RC[-9]="FDCAN",INDEX(FDCAN标准帧长度!R4C5:R18C5,MATCH(RC[-8],FDCAN标准帧长度!R4C1:R18C1,0)),""),"") ->  | K22: =IFERROR(@IF(RC[-10]="FDCAN",INDEX(FDCAN标准帧长度!R4C6:R18C6,MATCH(RC[-9],FDCAN标准帧长度!R4C1:R18C1,0)),""),"") ->  | L22: =IF(RC[-11]="CAN标准帧",计算中间变量区!RC[-4],IF(RC[-11]="CAN拓展帧",计算中间变量区!RC[-3],IF(RC[-11]="FDCAN",RC[-2],""))) ->  | M22: =IF(RC[-12]="FDCAN",计算中间变量区!RC[-2],"") ->  | N22: =IFERROR(IF(RC[-13]="FDCAN",(RC[-2]*RC[-11]*RC[-10])/MINIFS(C[-9],C[-13],"FDCAN",C[-9],">0"),(RC[-2]*RC[-11]*RC[-10])/RC[-9]),"") ->  | O22: =IFERROR((RC[-2]*RC[-12]*RC[-11])/RC[-10],"") ->  | S22: =IFERROR(@IF(RC[-18]="CAN标准帧",INDIRECT("经典CAN标准帧长度!C"&(3+计算器本体!R[1]C[-17])),""),"") ->  | T22: =IFERROR(@IF(RC[-19]="CAN拓展帧",INDIRECT("经典CAN拓展帧长度!C"&(3+RC[-18])),""),"") ->  | U22: =IFERROR(@IF(RC[-20]="FDCAN",INDEX(FDCAN标准帧长度!R4C2:R18C2,MATCH(RC[-19],FDCAN标准帧长度!R4C1:R18C1,0)),""),"") ->  | V22: =IFERROR(@IF(RC[-21]="FDCAN",INDEX(FDCAN标准帧长度!R4C3:R18C3,MATCH(RC2,FDCAN标准帧长度!R4C1:R18C1,0)),""),"") ->  | W22: =SUM(RC[-4]:RC[-2]) -> 0 | X22: =RC[-2] ->  | Y22: =IFERROR(IF(RC[-24]="FDCAN",(RC[-2]*RC[-22]*RC[-21])/MINIFS(C[-20],C[-24],"FDCAN",C[-20],">0"),(RC[-2]*RC[-22]*RC[-21])/RC[-20]),"") ->  | Z22: =IFERROR(IF(MAX(C5)>1000000,(RC[-2]*RC3*RC4)/RC5,(RC[-2]*RC3*RC4)/MINIFS(C5,C[-21],">0")),"") -> 
A23: =计算器本体!R[1]C[3] -> 0 | B23: =计算器本体!R[1]C -> 0 | C23: =计算器本体!R[1]C -> 0 | D23: =计算器本体!R[1]C[-3] -> 0 | E23: =计算器本体!R[1]C -> 0 | F23: =IF(RC[-5]="FDCAN",5000000,IF(OR(RC[-5]="CAN标准帧",RC[-5]="CAN拓展帧"),IF(COUNTIFS(C[-5],"CAN标准帧",C[-1],">0")*COUNTIFS(C[-5],"CAN拓展帧",C[-1],">0")>0,MIN(1000000,MINIFS(C[-1],C[-5],{"CAN标准帧","CAN拓展帧"},C[-1],">0")),1000000),"")) ->  | G23: =IF(OR(RC[-6]="",RC[-2]=0),"",IF(RC[-6]="FDCAN",IF(RC[-2]>5000000,"FDCAN可变段超限（最大5M）",IF(RC[-2]<1000000,"FDCAN波特率低于1M","")),IF(RC[-2]>RC[-1],"非FDCAN波特率超限（最大应跟随总线上波特率最低设备"&RC[-1]&"）",IF(COUNTIFS(C[-6],{"CAN标准帧","CAN拓展帧"},C[-2],"<>"&RC[-1])>0,"混合帧波特率不统一，存在波特率不一致的设备，例如第"&AGGREGATE(15,6,@ROW(R2C1:R1000C1)/((@R2C[-6]:R1000C[-6]={"CAN标准帧","CAN拓展帧"})*(@R2C[-2]:R1000C[-2]<>R2C[-1])),1)+1&"行设备，波特率为"&AGGREGATE(15,6,@R2C[-2]:R1000C[-2]/((@R2C[-6]:R1000C[-6]={"CAN标准帧","CAN拓展帧"})*(@R2C[-2]:R1000C[-2]<>R2C[-1])),1)&"bps","")))) ->  | H23: =IFERROR(@IF(RC[-7]="CAN标准帧",INDIRECT("经典CAN标准帧长度!D"&(3+RC[-6])),""),"") ->  | I23: =IFERROR(@IF(RC[-8]="CAN拓展帧",INDIRECT("经典CAN拓展帧长度!D"&(3+RC[-7])),""),"") ->  | J23: =IFERROR(@IF(RC[-9]="FDCAN",INDEX(FDCAN标准帧长度!R4C5:R18C5,MATCH(RC[-8],FDCAN标准帧长度!R4C1:R18C1,0)),""),"") ->  | K23: =IFERROR(@IF(RC[-10]="FDCAN",INDEX(FDCAN标准帧长度!R4C6:R18C6,MATCH(RC[-9],FDCAN标准帧长度!R4C1:R18C1,0)),""),"") ->  | L23: =IF(RC[-11]="CAN标准帧",计算中间变量区!RC[-4],IF(RC[-11]="CAN拓展帧",计算中间变量区!RC[-3],IF(RC[-11]="FDCAN",RC[-2],""))) ->  | M23: =IF(RC[-12]="FDCAN",计算中间变量区!RC[-2],"") ->  | N23: =IFERROR(IF(RC[-13]="FDCAN",(RC[-2]*RC[-11]*RC[-10])/MINIFS(C[-9],C[-13],"FDCAN",C[-9],">0"),(RC[-2]*RC[-11]*RC[-10])/RC[-9]),"") ->  | O23: =IFERROR((RC[-2]*RC[-12]*RC[-11])/RC[-10],"") ->  | S23: =IFERROR(@IF(RC[-18]="CAN标准帧",INDIRECT("经典CAN标准帧长度!C"&(3+计算器本体!R[1]C[-17])),""),"") ->  | T23: =IFERROR(@IF(RC[-19]="CAN拓展帧",INDIRECT("经典CAN拓展帧长度!C"&(3+RC[-18])),""),"") ->  | U23: =IFERROR(@IF(RC[-20]="FDCAN",INDEX(FDCAN标准帧长度!R4C2:R18C2,MATCH(RC[-19],FDCAN标准帧长度!R4C1:R18C1,0)),""),"") ->  | V23: =IFERROR(@IF(RC[-21]="FDCAN",INDEX(FDCAN标准帧长度!R4C3:R18C3,MATCH(RC2,FDCAN标准帧长度!R4C1:R18C1,0)),""),"") ->  | W23: =SUM(RC[-4]:RC[-2]) -> 0 | X23: =RC[-2] ->  | Y23: =IFERROR(IF(RC[-24]="FDCAN",(RC[-2]*RC[-22]*RC[-21])/MINIFS(C[-20],C[-24],"FDCAN",C[-20],">0"),(RC[-2]*RC[-22]*RC[-21])/RC[-20]),"") ->  | Z23: =IFERROR(IF(MAX(C5)>1000000,(RC[-2]*RC3*RC4)/RC5,(RC[-2]*RC3*RC4)/MINIFS(C5,C[-21],">0")),"") -> 
A24: =计算器本体!R[1]C[3] -> 0 | B24: =计算器本体!R[1]C -> 0 | C24: =计算器本体!R[1]C -> 0 | D24: =计算器本体!R[1]C[-3] -> 0 | E24: =计算器本体!R[1]C -> 0 | F24: =IF(RC[-5]="FDCAN",5000000,IF(OR(RC[-5]="CAN标准帧",RC[-5]="CAN拓展帧"),IF(COUNTIFS(C[-5],"CAN标准帧",C[-1],">0")*COUNTIFS(C[-5],"CAN拓展帧",C[-1],">0")>0,MIN(1000000,MINIFS(C[-1],C[-5],{"CAN标准帧","CAN拓展帧"},C[-1],">0")),1000000),"")) ->  | G24: =IF(OR(RC[-6]="",RC[-2]=0),"",IF(RC[-6]="FDCAN",IF(RC[-2]>5000000,"FDCAN可变段超限（最大5M）",IF(RC[-2]<1000000,"FDCAN波特率低于1M","")),IF(RC[-2]>RC[-1],"非FDCAN波特率超限（最大应跟随总线上波特率最低设备"&RC[-1]&"）",IF(COUNTIFS(C[-6],{"CAN标准帧","CAN拓展帧"},C[-2],"<>"&RC[-1])>0,"混合帧波特率不统一，存在波特率不一致的设备，例如第"&AGGREGATE(15,6,@ROW(R2C1:R1000C1)/((@R2C[-6]:R1000C[-6]={"CAN标准帧","CAN拓展帧"})*(@R2C[-2]:R1000C[-2]<>R2C[-1])),1)+1&"行设备，波特率为"&AGGREGATE(15,6,@R2C[-2]:R1000C[-2]/((@R2C[-6]:R1000C[-6]={"CAN标准帧","CAN拓展帧"})*(@R2C[-2]:R1000C[-2]<>R2C[-1])),1)&"bps","")))) ->  | H24: =IFERROR(@IF(RC[-7]="CAN标准帧",INDIRECT("经典CAN标准帧长度!D"&(3+RC[-6])),""),"") ->  | I24: =IFERROR(@IF(RC[-8]="CAN拓展帧",INDIRECT("经典CAN拓展帧长度!D"&(3+RC[-7])),""),"") ->  | J24: =IFERROR(@IF(RC[-9]="FDCAN",INDEX(FDCAN标准帧长度!R4C5:R18C5,MATCH(RC[-8],FDCAN标准帧长度!R4C1:R18C1,0)),""),"") ->  | K24: =IFERROR(@IF(RC[-10]="FDCAN",INDEX(FDCAN标准帧长度!R4C6:R18C6,MATCH(RC[-9],FDCAN标准帧长度!R4C1:R18C1,0)),""),"") ->  | L24: =IF(RC[-11]="CAN标准帧",计算中间变量区!RC[-4],IF(RC[-11]="CAN拓展帧",计算中间变量区!RC[-3],IF(RC[-11]="FDCAN",RC[-2],""))) ->  | M24: =IF(RC[-12]="FDCAN",计算中间变量区!RC[-2],"") ->  | N24: =IFERROR(IF(RC[-13]="FDCAN",(RC[-2]*RC[-11]*RC[-10])/MINIFS(C[-9],C[-13],"FDCAN",C[-9],">0"),(RC[-2]*RC[-11]*RC[-10])/RC[-9]),"") ->  | O24: =IFERROR((RC[-2]*RC[-12]*RC[-11])/RC[-10],"") ->  | S24: =IFERROR(@IF(RC[-18]="CAN标准帧",INDIRECT("经典CAN标准帧长度!C"&(3+计算器本体!R[1]C[-17])),""),"") ->  | T24: =IFERROR(@IF(RC[-19]="CAN拓展帧",INDIRECT("经典CAN拓展帧长度!C"&(3+RC[-18])),""),"") ->  | U24: =IFERROR(@IF(RC[-20]="FDCAN",INDEX(FDCAN标准帧长度!R4C2:R18C2,MATCH(RC[-19],FDCAN标准帧长度!R4C1:R18C1,0)),""),"") ->  | V24: =IFERROR(@IF(RC[-21]="FDCAN",INDEX(FDCAN标准帧长度!R4C3:R18C3,MATCH(RC2,FDCAN标准帧长度!R4C1:R18C1,0)),""),"") ->  | W24: =SUM(RC[-4]:RC[-2]) -> 0 | X24: =RC[-2] ->  | Y24: =IFERROR(IF(RC[-24]="FDCAN",(RC[-2]*RC[-22]*RC[-21])/MINIFS(C[-20],C[-24],"FDCAN",C[-20],">0"),(RC[-2]*RC[-22]*RC[-21])/RC[-20]),"") ->  | Z24: =IFERROR(IF(MAX(C5)>1000000,(RC[-2]*RC3*RC4)/RC5,(RC[-2]*RC3*RC4)/MINIFS(C5,C[-21],">0")),"") -> 
A25: =计算器本体!R[1]C[3] -> 0 | B25: =计算器本体!R[1]C -> 0 | C25: =计算器本体!R[1]C -> 0 | D25: =计算器本体!R[1]C[-3] -> 0 | E25: =计算器本体!R[1]C -> 0 | F25: =IF(RC[-5]="FDCAN",5000000,IF(OR(RC[-5]="CAN标准帧",RC[-5]="CAN拓展帧"),IF(COUNTIFS(C[-5],"CAN标准帧",C[-1],">0")*COUNTIFS(C[-5],"CAN拓展帧",C[-1],">0")>0,MIN(1000000,MINIFS(C[-1],C[-5],{"CAN标准帧","CAN拓展帧"},C[-1],">0")),1000000),"")) ->  | G25: =IF(OR(RC[-6]="",RC[-2]=0),"",IF(RC[-6]="FDCAN",IF(RC[-2]>5000000,"FDCAN可变段超限（最大5M）",IF(RC[-2]<1000000,"FDCAN波特率低于1M","")),IF(RC[-2]>RC[-1],"非FDCAN波特率超限（最大应跟随总线上波特率最低设备"&RC[-1]&"）",IF(COUNTIFS(C[-6],{"CAN标准帧","CAN拓展帧"},C[-2],"<>"&RC[-1])>0,"混合帧波特率不统一，存在波特率不一致的设备，例如第"&AGGREGATE(15,6,@ROW(R2C1:R1000C1)/((@R2C[-6]:R1000C[-6]={"CAN标准帧","CAN拓展帧"})*(@R2C[-2]:R1000C[-2]<>R2C[-1])),1)+1&"行设备，波特率为"&AGGREGATE(15,6,@R2C[-2]:R1000C[-2]/((@R2C[-6]:R1000C[-6]={"CAN标准帧","CAN拓展帧"})*(@R2C[-2]:R1000C[-2]<>R2C[-1])),1)&"bps","")))) ->  | H25: =IFERROR(@IF(RC[-7]="CAN标准帧",INDIRECT("经典CAN标准帧长度!D"&(3+RC[-6])),""),"") ->  | I25: =IFERROR(@IF(RC[-8]="CAN拓展帧",INDIRECT("经典CAN拓展帧长度!D"&(3+RC[-7])),""),"") ->  | J25: =IFERROR(@IF(RC[-9]="FDCAN",INDEX(FDCAN标准帧长度!R4C5:R18C5,MATCH(RC[-8],FDCAN标准帧长度!R4C1:R18C1,0)),""),"") ->  | K25: =IFERROR(@IF(RC[-10]="FDCAN",INDEX(FDCAN标准帧长度!R4C6:R18C6,MATCH(RC[-9],FDCAN标准帧长度!R4C1:R18C1,0)),""),"") ->  | L25: =IF(RC[-11]="CAN标准帧",计算中间变量区!RC[-4],IF(RC[-11]="CAN拓展帧",计算中间变量区!RC[-3],IF(RC[-11]="FDCAN",RC[-2],""))) ->  | M25: =IF(RC[-12]="FDCAN",计算中间变量区!RC[-2],"") ->  | N25: =IFERROR(IF(RC[-13]="FDCAN",(RC[-2]*RC[-11]*RC[-10])/MINIFS(C[-9],C[-13],"FDCAN",C[-9],">0"),(RC[-2]*RC[-11]*RC[-10])/RC[-9]),"") ->  | O25: =IFERROR((RC[-2]*RC[-12]*RC[-11])/RC[-10],"") ->  | S25: =IFERROR(@IF(RC[-18]="CAN标准帧",INDIRECT("经典CAN标准帧长度!C"&(3+计算器本体!R[1]C[-17])),""),"") ->  | T25: =IFERROR(@IF(RC[-19]="CAN拓展帧",INDIRECT("经典CAN拓展帧长度!C"&(3+RC[-18])),""),"") ->  | U25: =IFERROR(@IF(RC[-20]="FDCAN",INDEX(FDCAN标准帧长度!R4C2:R18C2,MATCH(RC[-19],FDCAN标准帧长度!R4C1:R18C1,0)),""),"") ->  | V25: =IFERROR(@IF(RC[-21]="FDCAN",INDEX(FDCAN标准帧长度!R4C3:R18C3,MATCH(RC2,FDCAN标准帧长度!R4C1:R18C1,0)),""),"") ->  | W25: =SUM(RC[-4]:RC[-2]) -> 0 | X25: =RC[-2] ->  | Y25: =IFERROR(IF(RC[-24]="FDCAN",(RC[-2]*RC[-22]*RC[-21])/MINIFS(C[-20],C[-24],"FDCAN",C[-20],">0"),(RC[-2]*RC[-22]*RC[-21])/RC[-20]),"") ->  | Z25: =IFERROR(IF(MAX(C5)>1000000,(RC[-2]*RC3*RC4)/RC5,(RC[-2]*RC3*RC4)/MINIFS(C5,C[-21],">0")),"") -> 
A26: =计算器本体!R[1]C[3] -> 0 | B26: =计算器本体!R[1]C -> 0 | C26: =计算器本体!R[1]C -> 0 | D26: =计算器本体!R[1]C[-3] -> 0 | E26: =计算器本体!R[1]C -> 0 | F26: =IF(RC[-5]="FDCAN",5000000,IF(OR(RC[-5]="CAN标准帧",RC[-5]="CAN拓展帧"),IF(COUNTIFS(C[-5],"CAN标准帧",C[-1],">0")*COUNTIFS(C[-5],"CAN拓展帧",C[-1],">0")>0,MIN(1000000,MINIFS(C[-1],C[-5],{"CAN标准帧","CAN拓展帧"},C[-1],">0")),1000000),"")) ->  | G26: =IF(OR(RC[-6]="",RC[-2]=0),"",IF(RC[-6]="FDCAN",IF(RC[-2]>5000000,"FDCAN可变段超限（最大5M）",IF(RC[-2]<1000000,"FDCAN波特率低于1M","")),IF(RC[-2]>RC[-1],"非FDCAN波特率超限（最大应跟随总线上波特率最低设备"&RC[-1]&"）",IF(COUNTIFS(C[-6],{"CAN标准帧","CAN拓展帧"},C[-2],"<>"&RC[-1])>0,"混合帧波特率不统一，存在波特率不一致的设备，例如第"&AGGREGATE(15,6,@ROW(R2C1:R1000C1)/((@R2C[-6]:R1000C[-6]={"CAN标准帧","CAN拓展帧"})*(@R2C[-2]:R1000C[-2]<>R2C[-1])),1)+1&"行设备，波特率为"&AGGREGATE(15,6,@R2C[-2]:R1000C[-2]/((@R2C[-6]:R1000C[-6]={"CAN标准帧","CAN拓展帧"})*(@R2C[-2]:R1000C[-2]<>R2C[-1])),1)&"bps","")))) ->  | H26: =IFERROR(@IF(RC[-7]="CAN标准帧",INDIRECT("经典CAN标准帧长度!D"&(3+RC[-6])),""),"") ->  | I26: =IFERROR(@IF(RC[-8]="CAN拓展帧",INDIRECT("经典CAN拓展帧长度!D"&(3+RC[-7])),""),"") ->  | J26: =IFERROR(@IF(RC[-9]="FDCAN",INDEX(FDCAN标准帧长度!R4C5:R18C5,MATCH(RC[-8],FDCAN标准帧长度!R4C1:R18C1,0)),""),"") ->  | K26: =IFERROR(@IF(RC[-10]="FDCAN",INDEX(FDCAN标准帧长度!R4C6:R18C6,MATCH(RC[-9],FDCAN标准帧长度!R4C1:R18C1,0)),""),"") ->  | L26: =IF(RC[-11]="CAN标准帧",计算中间变量区!RC[-4],IF(RC[-11]="CAN拓展帧",计算中间变量区!RC[-3],IF(RC[-11]="FDCAN",RC[-2],""))) ->  | M26: =IF(RC[-12]="FDCAN",计算中间变量区!RC[-2],"") ->  | N26: =IFERROR(IF(RC[-13]="FDCAN",(RC[-2]*RC[-11]*RC[-10])/MINIFS(C[-9],C[-13],"FDCAN",C[-9],">0"),(RC[-2]*RC[-11]*RC[-10])/RC[-9]),"") ->  | O26: =IFERROR((RC[-2]*RC[-12]*RC[-11])/RC[-10],"") ->  | S26: =IFERROR(@IF(RC[-18]="CAN标准帧",INDIRECT("经典CAN标准帧长度!C"&(3+计算器本体!R[1]C[-17])),""),"") ->  | T26: =IFERROR(@IF(RC[-19]="CAN拓展帧",INDIRECT("经典CAN拓展帧长度!C"&(3+RC[-18])),""),"") ->  | U26: =IFERROR(@IF(RC[-20]="FDCAN",INDEX(FDCAN标准帧长度!R4C2:R18C2,MATCH(RC[-19],FDCAN标准帧长度!R4C1:R18C1,0)),""),"") ->  | V26: =IFERROR(@IF(RC[-21]="FDCAN",INDEX(FDCAN标准帧长度!R4C3:R18C3,MATCH(RC2,FDCAN标准帧长度!R4C1:R18C1,0)),""),"") ->  | W26: =SUM(RC[-4]:RC[-2]) -> 0 | X26: =RC[-2] ->  | Y26: =IFERROR(IF(RC[-24]="FDCAN",(RC[-2]*RC[-22]*RC[-21])/MINIFS(C[-20],C[-24],"FDCAN",C[-20],">0"),(RC[-2]*RC[-22]*RC[-21])/RC[-20]),"") ->  | Z26: =IFERROR(IF(MAX(C5)>1000000,(RC[-2]*RC3*RC4)/RC5,(RC[-2]*RC3*RC4)/MINIFS(C5,C[-21],">0")),"") -> 
A27: =计算器本体!R[1]C[3] -> 0 | B27: =计算器本体!R[1]C -> 0 | C27: =计算器本体!R[1]C -> 0 | D27: =计算器本体!R[1]C[-3] -> 0 | E27: =计算器本体!R[1]C -> 0 | F27: =IF(RC[-5]="FDCAN",5000000,IF(OR(RC[-5]="CAN标准帧",RC[-5]="CAN拓展帧"),IF(COUNTIFS(C[-5],"CAN标准帧",C[-1],">0")*COUNTIFS(C[-5],"CAN拓展帧",C[-1],">0")>0,MIN(1000000,MINIFS(C[-1],C[-5],{"CAN标准帧","CAN拓展帧"},C[-1],">0")),1000000),"")) ->  | G27: =IF(OR(RC[-6]="",RC[-2]=0),"",IF(RC[-6]="FDCAN",IF(RC[-2]>5000000,"FDCAN可变段超限（最大5M）",IF(RC[-2]<1000000,"FDCAN波特率低于1M","")),IF(RC[-2]>RC[-1],"非FDCAN波特率超限（最大应跟随总线上波特率最低设备"&RC[-1]&"）",IF(COUNTIFS(C[-6],{"CAN标准帧","CAN拓展帧"},C[-2],"<>"&RC[-1])>0,"混合帧波特率不统一，存在波特率不一致的设备，例如第"&AGGREGATE(15,6,@ROW(R2C1:R1000C1)/((@R2C[-6]:R1000C[-6]={"CAN标准帧","CAN拓展帧"})*(@R2C[-2]:R1000C[-2]<>R2C[-1])),1)+1&"行设备，波特率为"&AGGREGATE(15,6,@R2C[-2]:R1000C[-2]/((@R2C[-6]:R1000C[-6]={"CAN标准帧","CAN拓展帧"})*(@R2C[-2]:R1000C[-2]<>R2C[-1])),1)&"bps","")))) ->  | H27: =IFERROR(@IF(RC[-7]="CAN标准帧",INDIRECT("经典CAN标准帧长度!D"&(3+RC[-6])),""),"") ->  | I27: =IFERROR(@IF(RC[-8]="CAN拓展帧",INDIRECT("经典CAN拓展帧长度!D"&(3+RC[-7])),""),"") ->  | J27: =IFERROR(@IF(RC[-9]="FDCAN",INDEX(FDCAN标准帧长度!R4C5:R18C5,MATCH(RC[-8],FDCAN标准帧长度!R4C1:R18C1,0)),""),"") ->  | K27: =IFERROR(@IF(RC[-10]="FDCAN",INDEX(FDCAN标准帧长度!R4C6:R18C6,MATCH(RC[-9],FDCAN标准帧长度!R4C1:R18C1,0)),""),"") ->  | L27: =IF(RC[-11]="CAN标准帧",计算中间变量区!RC[-4],IF(RC[-11]="CAN拓展帧",计算中间变量区!RC[-3],IF(RC[-11]="FDCAN",RC[-2],""))) ->  | M27: =IF(RC[-12]="FDCAN",计算中间变量区!RC[-2],"") ->  | N27: =IFERROR(IF(RC[-13]="FDCAN",(RC[-2]*RC[-11]*RC[-10])/MINIFS(C[-9],C[-13],"FDCAN",C[-9],">0"),(RC[-2]*RC[-11]*RC[-10])/RC[-9]),"") ->  | O27: =IFERROR((RC[-2]*RC[-12]*RC[-11])/RC[-10],"") ->  | S27: =IFERROR(@IF(RC[-18]="CAN标准帧",INDIRECT("经典CAN标准帧长度!C"&(3+计算器本体!R[1]C[-17])),""),"") ->  | T27: =IFERROR(@IF(RC[-19]="CAN拓展帧",INDIRECT("经典CAN拓展帧长度!C"&(3+RC[-18])),""),"") ->  | U27: =IFERROR(@IF(RC[-20]="FDCAN",INDEX(FDCAN标准帧长度!R4C2:R18C2,MATCH(RC[-19],FDCAN标准帧长度!R4C1:R18C1,0)),""),"") ->  | V27: =IFERROR(@IF(RC[-21]="FDCAN",INDEX(FDCAN标准帧长度!R4C3:R18C3,MATCH(RC2,FDCAN标准帧长度!R4C1:R18C1,0)),""),"") ->  | W27: =SUM(RC[-4]:RC[-2]) -> 0 | X27: =RC[-2] ->  | Y27: =IFERROR(IF(RC[-24]="FDCAN",(RC[-2]*RC[-22]*RC[-21])/MINIFS(C[-20],C[-24],"FDCAN",C[-20],">0"),(RC[-2]*RC[-22]*RC[-21])/RC[-20]),"") ->  | Z27: =IFERROR(IF(MAX(C5)>1000000,(RC[-2]*RC3*RC4)/RC5,(RC[-2]*RC3*RC4)/MINIFS(C5,C[-21],">0")),"") -> 
A28: =计算器本体!R[1]C[3] -> 0 | B28: =计算器本体!R[1]C -> 0 | C28: =计算器本体!R[1]C -> 0 | D28: =计算器本体!R[1]C[-3] -> 0 | E28: =计算器本体!R[1]C -> 0 | F28: =IF(RC[-5]="FDCAN",5000000,IF(OR(RC[-5]="CAN标准帧",RC[-5]="CAN拓展帧"),IF(COUNTIFS(C[-5],"CAN标准帧",C[-1],">0")*COUNTIFS(C[-5],"CAN拓展帧",C[-1],">0")>0,MIN(1000000,MINIFS(C[-1],C[-5],{"CAN标准帧","CAN拓展帧"},C[-1],">0")),1000000),"")) ->  | G28: =IF(OR(RC[-6]="",RC[-2]=0),"",IF(RC[-6]="FDCAN",IF(RC[-2]>5000000,"FDCAN可变段超限（最大5M）",IF(RC[-2]<1000000,"FDCAN波特率低于1M","")),IF(RC[-2]>RC[-1],"非FDCAN波特率超限（最大应跟随总线上波特率最低设备"&RC[-1]&"）",IF(COUNTIFS(C[-6],{"CAN标准帧","CAN拓展帧"},C[-2],"<>"&RC[-1])>0,"混合帧波特率不统一，存在波特率不一致的设备，例如第"&AGGREGATE(15,6,@ROW(R2C1:R1000C1)/((@R2C[-6]:R1000C[-6]={"CAN标准帧","CAN拓展帧"})*(@R2C[-2]:R1000C[-2]<>R2C[-1])),1)+1&"行设备，波特率为"&AGGREGATE(15,6,@R2C[-2]:R1000C[-2]/((@R2C[-6]:R1000C[-6]={"CAN标准帧","CAN拓展帧"})*(@R2C[-2]:R1000C[-2]<>R2C[-1])),1)&"bps","")))) ->  | H28: =IFERROR(@IF(RC[-7]="CAN标准帧",INDIRECT("经典CAN标准帧长度!D"&(3+RC[-6])),""),"") ->  | I28: =IFERROR(@IF(RC[-8]="CAN拓展帧",INDIRECT("经典CAN拓展帧长度!D"&(3+RC[-7])),""),"") ->  | J28: =IFERROR(@IF(RC[-9]="FDCAN",INDEX(FDCAN标准帧长度!R4C5:R18C5,MATCH(RC[-8],FDCAN标准帧长度!R4C1:R18C1,0)),""),"") ->  | K28: =IFERROR(@IF(RC[-10]="FDCAN",INDEX(FDCAN标准帧长度!R4C6:R18C6,MATCH(RC[-9],FDCAN标准帧长度!R4C1:R18C1,0)),""),"") ->  | L28: =IF(RC[-11]="CAN标准帧",计算中间变量区!RC[-4],IF(RC[-11]="CAN拓展帧",计算中间变量区!RC[-3],IF(RC[-11]="FDCAN",RC[-2],""))) ->  | M28: =IF(RC[-12]="FDCAN",计算中间变量区!RC[-2],"") ->  | N28: =IFERROR(IF(RC[-13]="FDCAN",(RC[-2]*RC[-11]*RC[-10])/MINIFS(C[-9],C[-13],"FDCAN",C[-9],">0"),(RC[-2]*RC[-11]*RC[-10])/RC[-9]),"") ->  | O28: =IFERROR((RC[-2]*RC[-12]*RC[-11])/RC[-10],"") ->  | S28: =IFERROR(@IF(RC[-18]="CAN标准帧",INDIRECT("经典CAN标准帧长度!C"&(3+计算器本体!R[1]C[-17])),""),"") ->  | T28: =IFERROR(@IF(RC[-19]="CAN拓展帧",INDIRECT("经典CAN拓展帧长度!C"&(3+RC[-18])),""),"") ->  | U28: =IFERROR(@IF(RC[-20]="FDCAN",INDEX(FDCAN标准帧长度!R4C2:R18C2,MATCH(RC[-19],FDCAN标准帧长度!R4C1:R18C1,0)),""),"") ->  | V28: =IFERROR(@IF(RC[-21]="FDCAN",INDEX(FDCAN标准帧长度!R4C3:R18C3,MATCH(RC2,FDCAN标准帧长度!R4C1:R18C1,0)),""),"") ->  | W28: =SUM(RC[-4]:RC[-2]) -> 0 | X28: =RC[-2] ->  | Y28: =IFERROR(IF(RC[-24]="FDCAN",(RC[-2]*RC[-22]*RC[-21])/MINIFS(C[-20],C[-24],"FDCAN",C[-20],">0"),(RC[-2]*RC[-22]*RC[-21])/RC[-20]),"") ->  | Z28: =IFERROR(IF(MAX(C5)>1000000,(RC[-2]*RC3*RC4)/RC5,(RC[-2]*RC3*RC4)/MINIFS(C5,C[-21],">0")),"") -> 
A29: =计算器本体!R[1]C[3] -> 0 | B29: =计算器本体!R[1]C -> 0 | C29: =计算器本体!R[1]C -> 0 | D29: =计算器本体!R[1]C[-3] -> 0 | E29: =计算器本体!R[1]C -> 0 | F29: =IF(RC[-5]="FDCAN",5000000,IF(OR(RC[-5]="CAN标准帧",RC[-5]="CAN拓展帧"),IF(COUNTIFS(C[-5],"CAN标准帧",C[-1],">0")*COUNTIFS(C[-5],"CAN拓展帧",C[-1],">0")>0,MIN(1000000,MINIFS(C[-1],C[-5],{"CAN标准帧","CAN拓展帧"},C[-1],">0")),1000000),"")) ->  | G29: =IF(OR(RC[-6]="",RC[-2]=0),"",IF(RC[-6]="FDCAN",IF(RC[-2]>5000000,"FDCAN可变段超限（最大5M）",IF(RC[-2]<1000000,"FDCAN波特率低于1M","")),IF(RC[-2]>RC[-1],"非FDCAN波特率超限（最大应跟随总线上波特率最低设备"&RC[-1]&"）",IF(COUNTIFS(C[-6],{"CAN标准帧","CAN拓展帧"},C[-2],"<>"&RC[-1])>0,"混合帧波特率不统一，存在波特率不一致的设备，例如第"&AGGREGATE(15,6,@ROW(R2C1:R1000C1)/((@R2C[-6]:R1000C[-6]={"CAN标准帧","CAN拓展帧"})*(@R2C[-2]:R1000C[-2]<>R2C[-1])),1)+1&"行设备，波特率为"&AGGREGATE(15,6,@R2C[-2]:R1000C[-2]/((@R2C[-6]:R1000C[-6]={"CAN标准帧","CAN拓展帧"})*(@R2C[-2]:R1000C[-2]<>R2C[-1])),1)&"bps","")))) ->  | H29: =IFERROR(@IF(RC[-7]="CAN标准帧",INDIRECT("经典CAN标准帧长度!D"&(3+RC[-6])),""),"") ->  | I29: =IFERROR(@IF(RC[-8]="CAN拓展帧",INDIRECT("经典CAN拓展帧长度!D"&(3+RC[-7])),""),"") ->  | J29: =IFERROR(@IF(RC[-9]="FDCAN",INDEX(FDCAN标准帧长度!R4C5:R18C5,MATCH(RC[-8],FDCAN标准帧长度!R4C1:R18C1,0)),""),"") ->  | K29: =IFERROR(@IF(RC[-10]="FDCAN",INDEX(FDCAN标准帧长度!R4C6:R18C6,MATCH(RC[-9],FDCAN标准帧长度!R4C1:R18C1,0)),""),"") ->  | L29: =IF(RC[-11]="CAN标准帧",计算中间变量区!RC[-4],IF(RC[-11]="CAN拓展帧",计算中间变量区!RC[-3],IF(RC[-11]="FDCAN",RC[-2],""))) ->  | M29: =IF(RC[-12]="FDCAN",计算中间变量区!RC[-2],"") ->  | N29: =IFERROR(IF(RC[-13]="FDCAN",(RC[-2]*RC[-11]*RC[-10])/MINIFS(C[-9],C[-13],"FDCAN",C[-9],">0"),(RC[-2]*RC[-11]*RC[-10])/RC[-9]),"") ->  | O29: =IFERROR((RC[-2]*RC[-12]*RC[-11])/RC[-10],"") ->  | S29: =IFERROR(@IF(RC[-18]="CAN标准帧",INDIRECT("经典CAN标准帧长度!C"&(3+计算器本体!R[1]C[-17])),""),"") ->  | T29: =IFERROR(@IF(RC[-19]="CAN拓展帧",INDIRECT("经典CAN拓展帧长度!C"&(3+RC[-18])),""),"") ->  | U29: =IFERROR(@IF(RC[-20]="FDCAN",INDEX(FDCAN标准帧长度!R4C2:R18C2,MATCH(RC[-19],FDCAN标准帧长度!R4C1:R18C1,0)),""),"") ->  | V29: =IFERROR(@IF(RC[-21]="FDCAN",INDEX(FDCAN标准帧长度!R4C3:R18C3,MATCH(RC2,FDCAN标准帧长度!R4C1:R18C1,0)),""),"") ->  | W29: =SUM(RC[-4]:RC[-2]) -> 0 | X29: =RC[-2] ->  | Y29: =IFERROR(IF(RC[-24]="FDCAN",(RC[-2]*RC[-22]*RC[-21])/MINIFS(C[-20],C[-24],"FDCAN",C[-20],">0"),(RC[-2]*RC[-22]*RC[-21])/RC[-20]),"") ->  | Z29: =IFERROR(IF(MAX(C5)>1000000,(RC[-2]*RC3*RC4)/RC5,(RC[-2]*RC3*RC4)/MINIFS(C5,C[-21],">0")),"") -> 
A30: =计算器本体!R[1]C[3] -> 0 | B30: =计算器本体!R[1]C -> 0 | C30: =计算器本体!R[1]C -> 0 | D30: =计算器本体!R[1]C[-3] -> 0 | E30: =计算器本体!R[1]C -> 0 | F30: =IF(RC[-5]="FDCAN",5000000,IF(OR(RC[-5]="CAN标准帧",RC[-5]="CAN拓展帧"),IF(COUNTIFS(C[-5],"CAN标准帧",C[-1],">0")*COUNTIFS(C[-5],"CAN拓展帧",C[-1],">0")>0,MIN(1000000,MINIFS(C[-1],C[-5],{"CAN标准帧","CAN拓展帧"},C[-1],">0")),1000000),"")) ->  | G30: =IF(OR(RC[-6]="",RC[-2]=0),"",IF(RC[-6]="FDCAN",IF(RC[-2]>5000000,"FDCAN可变段超限（最大5M）",IF(RC[-2]<1000000,"FDCAN波特率低于1M","")),IF(RC[-2]>RC[-1],"非FDCAN波特率超限（最大应跟随总线上波特率最低设备"&RC[-1]&"）",IF(COUNTIFS(C[-6],{"CAN标准帧","CAN拓展帧"},C[-2],"<>"&RC[-1])>0,"混合帧波特率不统一，存在波特率不一致的设备，例如第"&AGGREGATE(15,6,@ROW(R2C1:R1000C1)/((@R2C[-6]:R1000C[-6]={"CAN标准帧","CAN拓展帧"})*(@R2C[-2]:R1000C[-2]<>R2C[-1])),1)+1&"行设备，波特率为"&AGGREGATE(15,6,@R2C[-2]:R1000C[-2]/((@R2C[-6]:R1000C[-6]={"CAN标准帧","CAN拓展帧"})*(@R2C[-2]:R1000C[-2]<>R2C[-1])),1)&"bps","")))) ->  | H30: =IFERROR(@IF(RC[-7]="CAN标准帧",INDIRECT("经典CAN标准帧长度!D"&(3+RC[-6])),""),"") ->  | I30: =IFERROR(@IF(RC[-8]="CAN拓展帧",INDIRECT("经典CAN拓展帧长度!D"&(3+RC[-7])),""),"") ->  | J30: =IFERROR(@IF(RC[-9]="FDCAN",INDEX(FDCAN标准帧长度!R4C5:R18C5,MATCH(RC[-8],FDCAN标准帧长度!R4C1:R18C1,0)),""),"") ->  | K30: =IFERROR(@IF(RC[-10]="FDCAN",INDEX(FDCAN标准帧长度!R4C6:R18C6,MATCH(RC[-9],FDCAN标准帧长度!R4C1:R18C1,0)),""),"") ->  | L30: =IF(RC[-11]="CAN标准帧",计算中间变量区!RC[-4],IF(RC[-11]="CAN拓展帧",计算中间变量区!RC[-3],IF(RC[-11]="FDCAN",RC[-2],""))) ->  | M30: =IF(RC[-12]="FDCAN",计算中间变量区!RC[-2],"") ->  | N30: =IFERROR(IF(RC[-13]="FDCAN",(RC[-2]*RC[-11]*RC[-10])/MINIFS(C[-9],C[-13],"FDCAN",C[-9],">0"),(RC[-2]*RC[-11]*RC[-10])/RC[-9]),"") ->  | O30: =IFERROR((RC[-2]*RC[-12]*RC[-11])/RC[-10],"") ->  | S30: =IFERROR(@IF(RC[-18]="CAN标准帧",INDIRECT("经典CAN标准帧长度!C"&(3+计算器本体!R[1]C[-17])),""),"") ->  | U30: =IFERROR(@IF(RC[-20]="FDCAN",INDEX(FDCAN标准帧长度!R4C2:R18C2,MATCH(RC[-19],FDCAN标准帧长度!R4C1:R18C1,0)),""),"") ->  | V30: =IFERROR(@IF(RC[-21]="FDCAN",INDEX(FDCAN标准帧长度!R4C3:R18C3,MATCH(RC2,FDCAN标准帧长度!R4C1:R18C1,0)),""),"") ->  | W30: =SUM(RC[-4]:RC[-2]) -> 0 | X30: =RC[-2] ->  | Y30: =IFERROR(IF(RC[-24]="FDCAN",(RC[-2]*RC[-22]*RC[-21])/MINIFS(C[-20],C[-24],"FDCAN",C[-20],">0"),(RC[-2]*RC[-22]*RC[-21])/RC[-20]),"") ->  | Z30: =IFERROR(IF(MAX(C5)>1000000,(RC[-2]*RC3*RC4)/RC5,(RC[-2]*RC3*RC4)/MINIFS(C5,C[-21],">0")),"") -> 

Sheet: 经典CAN标准帧长度
A1: 数据段长度 | B1: 不包含数据段的单帧长度（位） | C1: 单帧长度（位） | D1: 考虑位填充机制的最大帧长度 | E1: 单帧长度（字节） | G1: 帧起始 | H1: 仲裁段 | J1: 控制段 | M1: 数据段 | N1: CRC段 | O1: ACK段 | P1: 帧结尾 | Q1: 帧间隔
G2: 帧起始 | H2: 帧ID | I2: 远程帧标志位 | J2: 识别符拓展位 | K2: 保留位占位符 | L2: 数据段长度 | M2: 最多8字节（64位） | N2: 15+1
G3: SOF | H3: ID | I3: RTR | J3: IDE | K3: r0 | L3: DLC | N3: CRC | O3: ACK | P3: EOF | Q3: IFS
A4: 1 | B4: =RC[1]-(RC[-1]*8) -> 47 | C4: =SUM(RC[4]:RC[14]) -> 55 | D4: =SUM(RC[3]:RC[7])+ROUNDDOWN(SUM(RC[3]:RC[7])/5,0)+SUM(RC[9]:RC[10])-1+ROUNDDOWN(SUM(RC[9]:RC[10])/5,0)+SUM(RC[8],RC[11]:RC[13]) -> 61 | E4: =RC[-1]/8 -> 7.625 | G4: 1 | H4: 11 | I4: 1 | J4: 1 | K4: 1 | L4: 4 | M4: 8 | N4: 16 | O4: 2 | P4: 7 | Q4: 3
A5: 2 | B5: =RC[1]-(RC[-1]*8) -> 47 | C5: =SUM(RC[4]:RC[14]) -> 63 | D5: =SUM(RC[3]:RC[7])+ROUNDDOWN(SUM(RC[3]:RC[7])/5,0)+SUM(RC[9]:RC[10])-1+ROUNDDOWN(SUM(RC[9]:RC[10])/5,0)+SUM(RC[8],RC[11]:RC[13]) -> 71 | E5: =RC[-1]/8 -> 8.875 | G5: 1 | H5: 11 | I5: 1 | J5: 1 | K5: 1 | L5: 4 | M5: 16 | N5: 16 | O5: 2 | P5: 7 | Q5: 3
A6: 3 | B6: =RC[1]-(RC[-1]*8) -> 47 | C6: =SUM(RC[4]:RC[14]) -> 71 | D6: =SUM(RC[3]:RC[7])+ROUNDDOWN(SUM(RC[3]:RC[7])/5,0)+SUM(RC[9]:RC[10])-1+ROUNDDOWN(SUM(RC[9]:RC[10])/5,0)+SUM(RC[8],RC[11]:RC[13]) -> 81 | E6: =RC[-1]/8 -> 10.125 | G6: 1 | H6: 11 | I6: 1 | J6: 1 | K6: 1 | L6: 4 | M6: 24 | N6: 16 | O6: 2 | P6: 7 | Q6: 3
A7: 4 | B7: =RC[1]-(RC[-1]*8) -> 47 | C7: =SUM(RC[4]:RC[14]) -> 79 | D7: =SUM(RC[3]:RC[7])+ROUNDDOWN(SUM(RC[3]:RC[7])/5,0)+SUM(RC[9]:RC[10])-1+ROUNDDOWN(SUM(RC[9]:RC[10])/5,0)+SUM(RC[8],RC[11]:RC[13]) -> 90 | E7: =RC[-1]/8 -> 11.25 | G7: 1 | H7: 11 | I7: 1 | J7: 1 | K7: 1 | L7: 4 | M7: 32 | N7: 16 | O7: 2 | P7: 7 | Q7: 3
A8: 5 | B8: =RC[1]-(RC[-1]*8) -> 47 | C8: =SUM(RC[4]:RC[14]) -> 87 | D8: =SUM(RC[3]:RC[7])+ROUNDDOWN(SUM(RC[3]:RC[7])/5,0)+SUM(RC[9]:RC[10])-1+ROUNDDOWN(SUM(RC[9]:RC[10])/5,0)+SUM(RC[8],RC[11]:RC[13]) -> 100 | E8: =RC[-1]/8 -> 12.5 | G8: 1 | H8: 11 | I8: 1 | J8: 1 | K8: 1 | L8: 4 | M8: 40 | N8: 16 | O8: 2 | P8: 7 | Q8: 3
A9: 6 | B9: =RC[1]-(RC[-1]*8) -> 47 | C9: =SUM(RC[4]:RC[14]) -> 95 | D9: =SUM(RC[3]:RC[7])+ROUNDDOWN(SUM(RC[3]:RC[7])/5,0)+SUM(RC[9]:RC[10])-1+ROUNDDOWN(SUM(RC[9]:RC[10])/5,0)+SUM(RC[8],RC[11]:RC[13]) -> 109 | E9: =RC[-1]/8 -> 13.625 | G9: 1 | H9: 11 | I9: 1 | J9: 1 | K9: 1 | L9: 4 | M9: 48 | N9: 16 | O9: 2 | P9: 7 | Q9: 3
A10: 7 | B10: =RC[1]-(RC[-1]*8) -> 47 | C10: =SUM(RC[4]:RC[14]) -> 103 | D10: =SUM(RC[3]:RC[7])+ROUNDDOWN(SUM(RC[3]:RC[7])/5,0)+SUM(RC[9]:RC[10])-1+ROUNDDOWN(SUM(RC[9]:RC[10])/5,0)+SUM(RC[8],RC[11]:RC[13]) -> 119 | E10: =RC[-1]/8 -> 14.875 | G10: 1 | H10: 11 | I10: 1 | J10: 1 | K10: 1 | L10: 4 | M10: 56 | N10: 16 | O10: 2 | P10: 7 | Q10: 3
A11: 8 | B11: =RC[1]-(RC[-1]*8) -> 47 | C11: =SUM(RC[4]:RC[14]) -> 111 | D11: =SUM(RC[3]:RC[7])+ROUNDDOWN(SUM(RC[3]:RC[7])/5,0)+SUM(RC[9]:RC[10])-1+ROUNDDOWN(SUM(RC[9]:RC[10])/5,0)+SUM(RC[8],RC[11]:RC[13]) -> 129 | E11: =RC[-1]/8 -> 16.125 | G11: 1 | H11: 11 | I11: 1 | J11: 1 | K11: 1 | L11: 4 | M11: 64 | N11: 16 | O11: 2 | P11: 7 | Q11: 3

Sheet: 经典CAN拓展帧长度
A1: 数据段长度 | B1: 不包含数据段的单帧长度（位） | C1: 单帧长度（位） | D1: 考虑位填充机制的最大帧长度 | E1: 单帧长度（字节） | G1: 帧起始 | H1: 仲裁段 | M1: 控制段 | O1: 数据段 | P1: CRC段 | Q1: ACK段 | R1: 帧结尾 | S1: 帧间隔
G2: 帧起始 | H2: 帧ID | I2: 替代远程请求标志位 | J2: 识别符拓展位 | K2: 拓展标识符 | L2: 远程帧标志位 | M2: 保留位 | N2: 数据段长度 | O2: 最多8字节（64位） | P2: 15+1
G3: SOF | H3: ID | I3: SRR | J3: IDE | K3: EID | L3: RTR | M3: RB1 RB0 | N3: DLC | P3: CRC | Q3: ACK | R3: EOF | S3: IFS
A4: 1 | B4: =RC[1]-(RC[-1]*8) -> 64 | C4: =SUM(RC[4]:RC[15]) -> 72 | D4: =SUM(RC[3]:RC[8])+ROUNDDOWN(SUM(RC[3]:RC[8])/5,0)+SUM(RC[9]:RC[10])-1+ROUNDDOWN(SUM(RC[9]:RC[10])/5,0)+(RC[12]-1)+ROUNDDOWN((RC[12]-1)/5,0)+SUM(RC[11],RC[13]:RC[15]) -> 83 | E4: =RC[-1]/8 -> 10.375 | G4: 1 | H4: 11 | I4: 1 | J4: 1 | K4: 18 | L4: 1 | M4: 2 | N4: 4 | O4: 8 | P4: 16 | Q4: 2 | R4: 7 | S4: 3
A5: 2 | B5: =RC[1]-(RC[-1]*8) -> 64 | C5: =SUM(RC[4]:RC[15]) -> 80 | D5: =SUM(RC[3]:RC[8])+ROUNDDOWN(SUM(RC[3]:RC[8])/5,0)+SUM(RC[9]:RC[10])-1+ROUNDDOWN(SUM(RC[9]:RC[10])/5,0)+(RC[12]-1)+ROUNDDOWN((RC[12]-1)/5,0)+SUM(RC[11],RC[13]:RC[15]) -> 91 | E5: =RC[-1]/8 -> 11.375 | G5: 1 | H5: 11 | I5: 1 | J5: 1 | K5: 18 | L5: 1 | M5: 2 | N5: 4 | O5: 16 | P5: 16 | Q5: 2 | R5: 7 | S5: 3
A6: 3 | B6: =RC[1]-(RC[-1]*8) -> 64 | C6: =SUM(RC[4]:RC[15]) -> 88 | D6: =SUM(RC[3]:RC[8])+ROUNDDOWN(SUM(RC[3]:RC[8])/5,0)+SUM(RC[9]:RC[10])-1+ROUNDDOWN(SUM(RC[9]:RC[10])/5,0)+(RC[12]-1)+ROUNDDOWN((RC[12]-1)/5,0)+SUM(RC[11],RC[13]:RC[15]) -> 99 | E6: =RC[-1]/8 -> 12.375 | G6: 1 | H6: 11 | I6: 1 | J6: 1 | K6: 18 | L6: 1 | M6: 2 | N6: 4 | O6: 24 | P6: 16 | Q6: 2 | R6: 7 | S6: 3
A7: 4 | B7: =RC[1]-(RC[-1]*8) -> 64 | C7: =SUM(RC[4]:RC[15]) -> 96 | D7: =SUM(RC[3]:RC[8])+ROUNDDOWN(SUM(RC[3]:RC[8])/5,0)+SUM(RC[9]:RC[10])-1+ROUNDDOWN(SUM(RC[9]:RC[10])/5,0)+(RC[12]-1)+ROUNDDOWN((RC[12]-1)/5,0)+SUM(RC[11],RC[13]:RC[15]) -> 107 | E7: =RC[-1]/8 -> 13.375 | G7: 1 | H7: 11 | I7: 1 | J7: 1 | K7: 18 | L7: 1 | M7: 2 | N7: 4 | O7: 32 | P7: 16 | Q7: 2 | R7: 7 | S7: 3
A8: 5 | B8: =RC[1]-(RC[-1]*8) -> 64 | C8: =SUM(RC[4]:RC[15]) -> 104 | D8: =SUM(RC[3]:RC[8])+ROUNDDOWN(SUM(RC[3]:RC[8])/5,0)+SUM(RC[9]:RC[10])-1+ROUNDDOWN(SUM(RC[9]:RC[10])/5,0)+(RC[12]-1)+ROUNDDOWN((RC[12]-1)/5,0)+SUM(RC[11],RC[13]:RC[15]) -> 115 | E8: =RC[-1]/8 -> 14.375 | G8: 1 | H8: 11 | I8: 1 | J8: 1 | K8: 18 | L8: 1 | M8: 2 | N8: 4 | O8: 40 | P8: 16 | Q8: 2 | R8: 7 | S8: 3
A9: 6 | B9: =RC[1]-(RC[-1]*8) -> 64 | C9: =SUM(RC[4]:RC[15]) -> 112 | D9: =SUM(RC[3]:RC[8])+ROUNDDOWN(SUM(RC[3]:RC[8])/5,0)+SUM(RC[9]:RC[10])-1+ROUNDDOWN(SUM(RC[9]:RC[10])/5,0)+(RC[12]-1)+ROUNDDOWN((RC[12]-1)/5,0)+SUM(RC[11],RC[13]:RC[15]) -> 123 | E9: =RC[-1]/8 -> 15.375 | G9: 1 | H9: 11 | I9: 1 | J9: 1 | K9: 18 | L9: 1 | M9: 2 | N9: 4 | O9: 48 | P9: 16 | Q9: 2 | R9: 7 | S9: 3
A10: 7 | B10: =RC[1]-(RC[-1]*8) -> 64 | C10: =SUM(RC[4]:RC[15]) -> 120 | D10: =SUM(RC[3]:RC[8])+ROUNDDOWN(SUM(RC[3]:RC[8])/5,0)+SUM(RC[9]:RC[10])-1+ROUNDDOWN(SUM(RC[9]:RC[10])/5,0)+(RC[12]-1)+ROUNDDOWN((RC[12]-1)/5,0)+SUM(RC[11],RC[13]:RC[15]) -> 131 | E10: =RC[-1]/8 -> 16.375 | G10: 1 | H10: 11 | I10: 1 | J10: 1 | K10: 18 | L10: 1 | M10: 2 | N10: 4 | O10: 56 | P10: 16 | Q10: 2 | R10: 7 | S10: 3
A11: 8 | B11: =RC[1]-(RC[-1]*8) -> 64 | C11: =SUM(RC[4]:RC[15]) -> 128 | D11: =SUM(RC[3]:RC[8])+ROUNDDOWN(SUM(RC[3]:RC[8])/5,0)+SUM(RC[9]:RC[10])-1+ROUNDDOWN(SUM(RC[9]:RC[10])/5,0)+(RC[12]-1)+ROUNDDOWN((RC[12]-1)/5,0)+SUM(RC[11],RC[13]:RC[15]) -> 139 | E11: =RC[-1]/8 -> 17.375 | G11: 1 | H11: 11 | I11: 1 | J11: 1 | K11: 18 | L11: 1 | M11: 2 | N11: 4 | O11: 64 | P11: 16 | Q11: 2 | R11: 7 | S11: 3
A13: 写到一半意识到RM场景根本用不到拓展帧，拓展帧拓展的是ID段，并不能增加数据段长度，除非拿ID作为信息的一部分，不同帧ID视为不同状态，但是应该不存在这种用法吧，不打算增加拓展帧计算的特殊处理
A14: 经群友补充，高擎和小米电机需要用到拓展帧，所以还是加入处理吧

Sheet: FDCAN标准帧长度
A1: 数据段长度 | B1: 固定波特率段长度 | C1: 可变波特率段长度 | E1: 考虑位填充机制的最大帧长度 | H1: 帧起始 | I1: 仲裁段 | K1: 控制段 | Q1: 数据段 | R1: CRC段 | T1: ACK段 | U1: 帧结尾 | V1: 帧间隔
E2: 每5位连续电平插入一位相反位） | H2: 帧起始 | I2: 帧ID | K2: 识别符拓展位 | L2: 可变波特率帧标志位 | M2: 保留位 | N2: 位速率转换位 | O2: 发送节点错误状态指示 | P2: 数据段长度 | Q2: 最多64字节（512位） | R2: 填充位的个数对应8的模 | S2: 17+1或21+1
E3: 固定波特率段 | F3: 可变波特率段 | H3: SOF | I3: ID | J3: RRS | K3: IDE | L3: FDF | M3: res | N3: BRS | O3: ESI | P3: DLC | R3: Stuff Count | S3: CRC | T3: ACK | U3: EOF | V3: IFS
A4: 1 | B4: =SUM(RC[6]:RC[11],RC[18]:RC[20]) -> 28 | C4: =SUM(RC[11]:RC[16]) -> 36 | E4: =SUM(RC[3]:RC[8])+ROUNDDOWN(SUM(RC[3]:RC[8])/5,0)+SUM(RC[15]:RC[17]) -> 31 | F4: =SUM(RC[8]:RC[13])+ROUNDDOWN((SUM(RC[8]:RC[13])-1)/5,0) -> 43 | H4: 1 | I4: 11 | J4: 1 | K4: 1 | L4: 1 | M4: 1 | N4: 1 | O4: 1 | P4: 4 | Q4: =8*RC[-16] -> 8 | R4: 4 | S4: =17+1 -> 18 | T4: 2 | U4: 7 | V4: 3
A5: 2 | B5: =SUM(RC[6]:RC[11],RC[18]:RC[20]) -> 28 | C5: =SUM(RC[11]:RC[16]) -> 44 | E5: =SUM(RC[3]:RC[8])+ROUNDDOWN(SUM(RC[3]:RC[8])/5,0)+SUM(RC[15]:RC[17]) -> 31 | F5: =SUM(RC[8]:RC[13])+ROUNDDOWN((SUM(RC[8]:RC[13])-1)/5,0) -> 52 | H5: 1 | I5: 11 | J5: 1 | K5: 1 | L5: 1 | M5: 1 | N5: 1 | O5: 1 | P5: 4 | Q5: =8*RC[-16] -> 16 | R5: 4 | S5: =17+1 -> 18 | T5: 2 | U5: 7 | V5: 3
A6: 3 | B6: =SUM(RC[6]:RC[11],RC[18]:RC[20]) -> 28 | C6: =SUM(RC[11]:RC[16]) -> 56 | E6: =SUM(RC[3]:RC[8])+ROUNDDOWN(SUM(RC[3]:RC[8])/5,0)+SUM(RC[15]:RC[17]) -> 31 | F6: =SUM(RC[8]:RC[13])+ROUNDDOWN((SUM(RC[8]:RC[13])-1)/5,0) -> 67 | H6: 1 | I6: 11 | J6: 1 | K6: 1 | L6: 1 | M6: 1 | N6: 1 | O6: 1 | P6: 4 | Q6: =8*RC[-16] -> 24 | R6: 4 | S6: =21+1 -> 22 | T6: 2 | U6: 7 | V6: 3
A7: 4 | B7: =SUM(RC[6]:RC[11],RC[18]:RC[20]) -> 28 | C7: =SUM(RC[11]:RC[16]) -> 64 | E7: =SUM(RC[3]:RC[8])+ROUNDDOWN(SUM(RC[3]:RC[8])/5,0)+SUM(RC[15]:RC[17]) -> 31 | F7: =SUM(RC[8]:RC[13])+ROUNDDOWN((SUM(RC[8]:RC[13])-1)/5,0) -> 76 | H7: 1 | I7: 11 | J7: 1 | K7: 1 | L7: 1 | M7: 1 | N7: 1 | O7: 1 | P7: 4 | Q7: =8*RC[-16] -> 32 | R7: 4 | S7: =21+1 -> 22 | T7: 2 | U7: 7 | V7: 3
A8: 5 | B8: =SUM(RC[6]:RC[11],RC[18]:RC[20]) -> 28 | C8: =SUM(RC[11]:RC[16]) -> 72 | E8: =SUM(RC[3]:RC[8])+ROUNDDOWN(SUM(RC[3]:RC[8])/5,0)+SUM(RC[15]:RC[17]) -> 31 | F8: =SUM(RC[8]:RC[13])+ROUNDDOWN((SUM(RC[8]:RC[13])-1)/5,0) -> 86 | H8: 1 | I8: 11 | J8: 1 | K8: 1 | L8: 1 | M8: 1 | N8: 1 | O8: 1 | P8: 4 | Q8: =8*RC[-16] -> 40 | R8: 4 | S8: =21+1 -> 22 | T8: 2 | U8: 7 | V8: 3
A9: 6 | B9: =SUM(RC[6]:RC[11],RC[18]:RC[20]) -> 28 | C9: =SUM(RC[11]:RC[16]) -> 80 | E9: =SUM(RC[3]:RC[8])+ROUNDDOWN(SUM(RC[3]:RC[8])/5,0)+SUM(RC[15]:RC[17]) -> 31 | F9: =SUM(RC[8]:RC[13])+ROUNDDOWN((SUM(RC[8]:RC[13])-1)/5,0) -> 95 | H9: 1 | I9: 11 | J9: 1 | K9: 1 | L9: 1 | M9: 1 | N9: 1 | O9: 1 | P9: 4 | Q9: =8*RC[-16] -> 48 | R9: 4 | S9: =21+1 -> 22 | T9: 2 | U9: 7 | V9: 3
A10: 7 | B10: =SUM(RC[6]:RC[11],RC[18]:RC[20]) -> 28 | C10: =SUM(RC[11]:RC[16]) -> 88 | E10: =SUM(RC[3]:RC[8])+ROUNDDOWN(SUM(RC[3]:RC[8])/5,0)+SUM(RC[15]:RC[17]) -> 31 | F10: =SUM(RC[8]:RC[13])+ROUNDDOWN((SUM(RC[8]:RC[13])-1)/5,0) -> 105 | H10: 1 | I10: 11 | J10: 1 | K10: 1 | L10: 1 | M10: 1 | N10: 1 | O10: 1 | P10: 4 | Q10: =8*RC[-16] -> 56 | R10: 4 | S10: =21+1 -> 22 | T10: 2 | U10: 7 | V10: 3
A11: 8 | B11: =SUM(RC[6]:RC[11],RC[18]:RC[20]) -> 28 | C11: =SUM(RC[11]:RC[16]) -> 96 | E11: =SUM(RC[3]:RC[8])+ROUNDDOWN(SUM(RC[3]:RC[8])/5,0)+SUM(RC[15]:RC[17]) -> 31 | F11: =SUM(RC[8]:RC[13])+ROUNDDOWN((SUM(RC[8]:RC[13])-1)/5,0) -> 115 | H11: 1 | I11: 11 | J11: 1 | K11: 1 | L11: 1 | M11: 1 | N11: 1 | O11: 1 | P11: 4 | Q11: =8*RC[-16] -> 64 | R11: 4 | S11: =21+1 -> 22 | T11: 2 | U11: 7 | V11: 3
A12: 12 | B12: =SUM(RC[6]:RC[11],RC[18]:RC[20]) -> 28 | C12: =SUM(RC[11]:RC[16]) -> 128 | E12: =SUM(RC[3]:RC[8])+ROUNDDOWN(SUM(RC[3]:RC[8])/5,0.1)+SUM(RC[15]:RC[17]) -> 31 | F12: =SUM(RC[8]:RC[13])+ROUNDDOWN((SUM(RC[8]:RC[13])-1)/5,0) -> 153 | H12: 1 | I12: 11 | J12: 1 | K12: 1 | L12: 1 | M12: 1 | N12: 1 | O12: 1 | P12: 4 | Q12: =8*RC[-16] -> 96 | R12: 4 | S12: =21+1 -> 22 | T12: 2 | U12: 7 | V12: 3
A13: 16 | B13: =SUM(RC[6]:RC[11],RC[18]:RC[20]) -> 28 | C13: =SUM(RC[11]:RC[16]) -> 160 | E13: =SUM(RC[3]:RC[8])+ROUNDDOWN(SUM(RC[3]:RC[8])/5,0.1)+SUM(RC[15]:RC[17]) -> 31 | F13: =SUM(RC[8]:RC[13])+ROUNDDOWN((SUM(RC[8]:RC[13])-1)/5,0) -> 191 | H13: 1 | I13: 11 | J13: 1 | K13: 1 | L13: 1 | M13: 1 | N13: 1 | O13: 1 | P13: 4 | Q13: =8*RC[-16] -> 128 | R13: 4 | S13: =21+1 -> 22 | T13: 2 | U13: 7 | V13: 3
A14: 20 | B14: =SUM(RC[6]:RC[11],RC[18]:RC[20]) -> 28 | C14: =SUM(RC[11]:RC[16]) -> 192 | E14: =SUM(RC[3]:RC[8])+ROUNDDOWN(SUM(RC[3]:RC[8])/5,0.1)+SUM(RC[15]:RC[17]) -> 31 | F14: =SUM(RC[8]:RC[13])+ROUNDDOWN((SUM(RC[8]:RC[13])-1)/5,0) -> 230 | H14: 1 | I14: 11 | J14: 1 | K14: 1 | L14: 1 | M14: 1 | N14: 1 | O14: 1 | P14: 4 | Q14: =8*RC[-16] -> 160 | R14: 4 | S14: =21+1 -> 22 | T14: 2 | U14: 7 | V14: 3
A15: 24 | B15: =SUM(RC[6]:RC[11],RC[18]:RC[20]) -> 28 | C15: =SUM(RC[11]:RC[16]) -> 224 | E15: =SUM(RC[3]:RC[8])+ROUNDDOWN(SUM(RC[3]:RC[8])/5,0.1)+SUM(RC[15]:RC[17]) -> 31 | F15: =SUM(RC[8]:RC[13])+ROUNDDOWN((SUM(RC[8]:RC[13])-1)/5,0) -> 268 | H15: 1 | I15: 11 | J15: 1 | K15: 1 | L15: 1 | M15: 1 | N15: 1 | O15: 1 | P15: 4 | Q15: =8*RC[-16] -> 192 | R15: 4 | S15: =21+1 -> 22 | T15: 2 | U15: 7 | V15: 3
A16: 32 | B16: =SUM(RC[6]:RC[11],RC[18]:RC[20]) -> 28 | C16: =SUM(RC[11]:RC[16]) -> 288 | E16: =SUM(RC[3]:RC[8])+ROUNDDOWN(SUM(RC[3]:RC[8])/5,0.1)+SUM(RC[15]:RC[17]) -> 31 | F16: =SUM(RC[8]:RC[13])+ROUNDDOWN((SUM(RC[8]:RC[13])-1)/5,0) -> 345 | H16: 1 | I16: 11 | J16: 1 | K16: 1 | L16: 1 | M16: 1 | N16: 1 | O16: 1 | P16: 4 | Q16: =8*RC[-16] -> 256 | R16: 4 | S16: =21+1 -> 22 | T16: 2 | U16: 7 | V16: 3
A17: 48 | B17: =SUM(RC[6]:RC[11],RC[18]:RC[20]) -> 28 | C17: =SUM(RC[11]:RC[16]) -> 416 | E17: =SUM(RC[3]:RC[8])+ROUNDDOWN(SUM(RC[3]:RC[8])/5,0.1)+SUM(RC[15]:RC[17]) -> 31 | F17: =SUM(RC[8]:RC[13])+ROUNDDOWN((SUM(RC[8]:RC[13])-1)/5,0) -> 499 | H17: 1 | I17: 11 | J17: 1 | K17: 1 | L17: 1 | M17: 1 | N17: 1 | O17: 1 | P17: 4 | Q17: =8*RC[-16] -> 384 | R17: 4 | S17: =21+1 -> 22 | T17: 2 | U17: 7 | V17: 3
A18: 64 | B18: =SUM(RC[6]:RC[11],RC[18]:RC[20]) -> 28 | C18: =SUM(RC[11]:RC[16]) -> 544 | E18: =SUM(RC[3]:RC[8])+ROUNDDOWN(SUM(RC[3]:RC[8])/5,0.1)+SUM(RC[15]:RC[17]) -> 31 | F18: =SUM(RC[8]:RC[13])+ROUNDDOWN((SUM(RC[8]:RC[13])-1)/5,0) -> 652 | H18: 1 | I18: 11 | J18: 1 | K18: 1 | L18: 1 | M18: 1 | N18: 1 | O18: 1 | P18: 4 | Q18: =8*RC[-16] -> 512 | R18: 4 | S18: =21+1 -> 22 | T18: 2 | U18: 7 | V18: 3
A20: 黄色为可变波特率段，该段为FDCAN设置的波特率，其他段仍最高为1Mbps